A1: 产品名称 | B1: 2022-7-18入库 货拉拉 | C1: 合计 | H1: 核算
A2: DeckLink Quad HDMI Recorder | B2: 9970448 9970364 9970469 9970476 9970361 | C2: =LEN(B2)-LEN(SUBSTITUTE(B2," ",""))+1 -> 5 | E2: 4 | F2: 1 | H2: =IF(C2=SUM(D2:G2),"","错") -> 
A3: DeckLink 8K Pro 24块 | B3: 10017329 10017344 10017340 10017326 10017325 10017336 10017333 10017335 10016519 10017337 10017365 10017367 10017369 10017330 10016523 10016512 10016514 10016517 10017342 10016434 10017343 10016535 10016533 10016481 | C3: =LEN(B3)-LEN(SUBSTITUTE(B3," ",""))+1 -> 24 | D3: 5 | E3: 14 | F3: 5 | H3: =IF(C3=SUM(D3:G3),"","错") -> 
A4: DeckLink Mini Monitor | B4: 9512237 9512291 9512223 9512244 9512263 9512240 9512344 | C4: =LEN(B4)-LEN(SUBSTITUTE(B4," ",""))+1 -> 7 | E4: 7 | H4: =IF(C4=SUM(D4:G4),"","错") -> 
A5: DeckLink Mini Recorder 4K | B5: 9546838 9546771 9546831 9546795 | C5: =LEN(B5)-LEN(SUBSTITUTE(B5," ",""))+1 -> 4 | G5: 4 | H5: =IF(C5=SUM(D5:G5),"","错") -> 
A6: UltraStudio 4K Mini | B6: 9974269 9974327 | C6: =LEN(B6)-LEN(SUBSTITUTE(B6," ",""))+1 -> 2 | G6: 2 | H6: =IF(C6=SUM(D6:G6),"","错") -> 
A7: Blackmagic Web Presenter 4K | B7: 9994263 9994252 | C7: =LEN(B7)-LEN(SUBSTITUTE(B7," ",""))+1 -> 2 | E7: 2 | H7: =IF(C7=SUM(D7:G7),"","错") -> 
A8: Blackmagic Pocket Cinema Camera 6K G2 | B8: 9967189 | C8: =LEN(B8)-LEN(SUBSTITUTE(B8," ",""))+1 -> 1 | G8: 1 | H8: =IF(C8=SUM(D8:G8),"","错") -> 
A9: Blackmagic URSA VLock Battery Plate | B9: 9623901 9624061 | C9: =LEN(B9)-LEN(SUBSTITUTE(B9," ",""))+1 -> 2 | G9: 2 | H9: =IF(C9=SUM(D9:G9),"","错") -> 
A10: Blackmagic Studio Camera 4K Plus | B10: 9916055 | C10: =LEN(B10)-LEN(SUBSTITUTE(B10," ",""))+1 -> 1 | E10: 1 | H10: =IF(C10=SUM(D10:G10),"","错") -> 
A11: Blackmagic Studio Camera 4K Pro | B11: 10015286 9921145 10014932 10015008 9921098 | C11: =LEN(B11)-LEN(SUBSTITUTE(B11," ",""))+1 -> 5 | F11: 5 | H11: =IF(C11=SUM(D11:G11),"","错") -> 
A12: Blackmagic Focus Demand | B12: 9676183 9959871 9959947 | C12: =LEN(B12)-LEN(SUBSTITUTE(B12," ",""))+1 -> 3 | F12: 3 | H12: =IF(C12=SUM(D12:G12),"","错") -> 
A13: Blackmagic Zoom Demand | B13: 9930694 9928756 9930760 | C13: =LEN(B13)-LEN(SUBSTITUTE(B13," ",""))+1 -> 3 | F13: 3 | H13: =IF(C13=SUM(D13:G13),"","错") -> 
A14: Blackmagic Studio Converter | B14: 9977876 9977817 9977784 9977824 9977779 9977828 9977826 | C14: =LEN(B14)-LEN(SUBSTITUTE(B14," ",""))+1 -> 7 | D14: 2 | F14: 5 | H14: =IF(C14=SUM(D14:G14),"","错") -> 
A15: Micro Converter BiDirectional SDI/HDMI 3G wPSU | B15: 10032917 10032928 | C15: =LEN(B15)-LEN(SUBSTITUTE(B15," ",""))+1 -> 2 | F15: 2 | H15: =IF(C15=SUM(D15:G15),"","错") -> 
A16: Micro Converter HDMI to SDI 3G | B16: 10028558 10028550 | C16: =LEN(B16)-LEN(SUBSTITUTE(B16," ",""))+1 -> 2 | F16: 2 | H16: =IF(C16=SUM(D16:G16),"","错") -> 
A17: Micro Converter SDI to HDMI 3G 40个 | B17: 10007318 10007403 10007342 10007375 10007324 10007388 10007310 10007363 10007330 10007345 10007340 10007303 10007260 10007338 10007354 10007348 10007353 10007401 10007370 10007373 10007361 10007349 10007384 10007366 10007387 10007313 10007379 10007372 10007325 10007382 10007259 10007322 10007383 10007392 10007191 10007195 10007337 10007314 10007380 10007386 | C17: =LEN(B17)-LEN(SUBSTITUTE(B17," ",""))+1 -> 40 | D17: 40 | H17: =IF(C17=SUM(D17:G17),"","错") -> 
A18: Micro Converter SDI to HDMI 3G wPSU | B18: 9943419 9943448 9943460 | C18: =LEN(B18)-LEN(SUBSTITUTE(B18," ",""))+1 -> 3 | F18: 3 | H18: =IF(C18=SUM(D18:G18),"","错") -> 
A19: Mini Converter - Audio to SDI 2 | B19: 9387820 9387852 9387862 | C19: =LEN(B19)-LEN(SUBSTITUTE(B19," ",""))+1 -> 3 | G19: 3 | H19: =IF(C19=SUM(D19:G19),"","错") -> 
A20: Mini Converter - SDI to Audio 4K | B20: 10042343 | C20: =LEN(B20)-LEN(SUBSTITUTE(B20," ",""))+1 -> 1 | G20: 1 | H20: =IF(C20=SUM(D20:G20),"","错") -> 
A21: Teranex Mini - SDI to HDMI 8K HDR | B21: 9871775 | C21: =LEN(B21)-LEN(SUBSTITUTE(B21," ",""))+1 -> 1 | F21: 1 | H21: =IF(C21=SUM(D21:G21),"","错") -> 
A22: DaVinci Resolve Mini Panel | B22: 9872958 | C22: =LEN(B22)-LEN(SUBSTITUTE(B22," ",""))+1 -> 1 | G22: 1 | H22: =IF(C22=SUM(D22:G22),"","错") -> 
A23: DaVinci Resolve Studio | B23: 9290845 9290789 9290848 9290575 | C23: =LEN(B23)-LEN(SUBSTITUTE(B23," ",""))+1 -> 4 | G23: 4 | H23: =IF(C23=SUM(D23:G23),"","错") -> 
A24: DaVinci Resolve Studio Dongle | B24: 8895790 8895756 8127342 8895801 8895829 | C24: =LEN(B24)-LEN(SUBSTITUTE(B24," ",""))+1 -> 5 | F24: 5 | H24: =IF(C24=SUM(D24:G24),"","错") -> 
A25: Blackmagic Audio Monitor 12G | B25: 10038132 | C25: =LEN(B25)-LEN(SUBSTITUTE(B25," ",""))+1 -> 1 | D25: 1 | H25: =IF(C25=SUM(D25:G25),"","错") -> 
A26: Blackmagic MultiView 4 HD | B26: 9973577 9969525 9969344 9968905 | C26: =LEN(B26)-LEN(SUBSTITUTE(B26," ",""))+1 -> 4 | G26: 4 | H26: =IF(C26=SUM(D26:G26),"","错") -> 
A27: Blackmagic Video Assist 7" 12G | B27: 10015606 10015745 | C27: =LEN(B27)-LEN(SUBSTITUTE(B27," ",""))+1 -> 2 | E27: 2 | H27: =IF(C27=SUM(D27:G27),"","错") -> 
A28: Video Assist Mini XLR Cables | B28: 9913327 9913344 9913328 | C28: =LEN(B28)-LEN(SUBSTITUTE(B28," ",""))+1 -> 3 | D28: 3 | H28: =IF(C28=SUM(D28:G28),"","错") -> 
A29: HyperDeck Studio HD Pro | B29: 10045371 10045176 | C29: =LEN(B29)-LEN(SUBSTITUTE(B29," ",""))+1 -> 2 | F29: 2 | H29: =IF(C29=SUM(D29:G29),"","错") -> 
A30: HyperDeck Studio 4K Pro | B30: 10035556 10034967 10034936 | C30: =LEN(B30)-LEN(SUBSTITUTE(B30," ",""))+1 -> 3 | D30: 3 | H30: =IF(C30=SUM(D30:G30),"","错") -> 
A31: ATEM Mini | B31: 9303865 9304015 9303803 9303744 | C31: =LEN(B31)-LEN(SUBSTITUTE(B31," ",""))+1 -> 4 | G31: 4 | H31: =IF(C31=SUM(D31:G31),"","错") -> 
A32: ATEM Mini Extreme ISO | B32: 9404071 | C32: =LEN(B32)-LEN(SUBSTITUTE(B32," ",""))+1 -> 1 | E32: 1 | H32: =IF(C32=SUM(D32:G32),"","错") -> 
A33: ATEM Constellation 8K | B33: 9922380 9926469 9926414 | C33: =LEN(B33)-LEN(SUBSTITUTE(B33," ",""))+1 -> 3 | D33: 1 | F33: 2 | H33: =IF(C33=SUM(D33:G33),"","错") -> 
A34: ATEM 2 M/E Advanced Panel 20 | B34: 9958168 | C34: =LEN(B34)-LEN(SUBSTITUTE(B34," ",""))+1 -> 1 | F34: 1 | H34: =IF(C34=SUM(D34:G34),"","错") -> 
A35: Adapter - 12G BD SFP Optical Module | B35: 9987251 9986589 | C35: =LEN(B35)-LEN(SUBSTITUTE(B35," ",""))+1 -> 2 | G35: 2 | H35: =IF(C35=SUM(D35:G35),"","错") -> 
A36: Smart Videohub 12x12 | B36: 9952415 | C36: =LEN(B36)-LEN(SUBSTITUTE(B36," ",""))+1 -> 1 | D36: 1 | H36: =IF(C36=SUM(D36:G36),"","错") -> 