A1: 产品名称 | B1: 2022-7-1入库 自提
A2: DeckLink Quad 2 | B2: 9922618 9922619 9922617 | C2: 3 | G2: 3 | H2: =SUM(D2:G2) -> 3
A3: DeckLink Quad HDMI Recorder | B3: 9970136 9970130 9970132 9970079 9970086 9970153 9970123 9970127 9970075 9970095 | C3: 10 | G3: 10 | H3: =SUM(D3:G3) -> 10
A4: Micro Converter SDI to HDMI 3G 入库20个 | B4: 9788697 9788724 9788701 9788703 9788722 9788721 9788675 9788717 9788720 9788400 9788399 9788397 9788696 9788683 9788695 9788676 9788404 9788394 9788714 9785102 9781270 9781273 9781274 9781282 9785107 9784507 9781262 9784505 9785109 9784502 9781281 9784512 9785110 9781260 9785106 9784510 9783948 9783952 9781259 9788725 | C4: 40 | D4: 10 | E4: 30 | H4: =SUM(D4:G4) -> 40
A5: Mini Converter - Optical Fiber 12G入库 60个 | B5: 9997645 9997678 9995549 9996157 9996166 9997666 9997807 9997642 9997634 9997757 9997775 9997819 9997787 9997789 9997633 9997795 9997794 9997781 9997793 9997670 9997652 9997660 9996123 9997674 9996175 9997762 9997644 9997802 9997813 9995681 9996158 9997631 9997672 9997790 9997643 9995327 9997780 9997773 9997783 9997661 9997769 9997799 9997760 9995515 9997751 9997669 9997767 9995162 9996162 9997785 9997765 9997677 9997772 9997650 9997770 9997786 9997665 9997667 9996185 9997817 | C5: 60 | G5: 60 | H5: =SUM(D5:G5) -> 60
A6: Mini Converter - SDI Distribution | B6: 9832662 9832655 9832583 9832672 | C6: 4 | D6: 4 | H6: =SUM(D6:G6) -> 4
A7: Teranex Mini - HDMI to SDI 12G | B7: 9989883 9989872 | C7: 2 | G7: 2 | H7: =SUM(D7:G7) -> 2
A8: Teranex Mini - Audio to SDI 12G | B8: 9706898 9706857 | C8: 2 | G8: 2 | H8: =SUM(D8:G8) -> 2
A9: Teranex Mini - SDI Distribution 12G | B9: 9988045 9988011 9988064 9988009 | C9: 4 | F9: 4 | H9: =SUM(D9:G9) -> 4
A10: SmartView 4K 2 | B10: 9993996 | C10: 1 | F10: 1 | H10: =SUM(D10:G10) -> 1
A11: Blackmagic Video Assist 7" 12G HDR | B11: 9603863 | C11: 1 | D11: 1 | H11: =SUM(D11:G11) -> 1
A12: HyperDeck Studio HD Pro | B12: 9928362 9928363 | C12: 2 | H12: =SUM(D12:G12) -> 0
A13: ATEM 2 M/E Production Studio 4K | B13: 9917789 9917609 | C13: 2 | E13: 2 | H13: =SUM(D13:G13) -> 2
A14: ATEM Television Studio HD | B14: 9619303 9619431 9562400 9619362 9562381 | C14: 5 | D14: 5 | H14: =SUM(D14:G14) -> 5
A15: Adapter - 3G BD SFP Optical Module | B15: 9631077 9782676 9782783 9630997 | C15: 4 | E15: 4 | H15: =SUM(D15:G15) -> 4
A16: Videohub Master Control Pro | B16: 9790454 | C16: 1 | E16: 1 | H16: =SUM(D16:G16) -> 1
A17: Smart Videohub 20x20 | B17: 9708180 | C17: 1 | D17: 1 | H17: =SUM(D17:G17) -> 1
A18: LA16*8BRM-XB1A(含手柄MS-X1) | C18: 3 | E18: 3 | H18: =SUM(D18:G18) -> 3
A19: CFC-12-990 | C19: 3
A20: SRD-92B | C20: 3
A21: CFH-3 | C21: 3
A22: FMM-X1 | C22: 3