A1: 产品名称 | B1: 2022-6-23入库 货拉拉 | D1: 第1张 | E1: 第2张 | F1: 第3张 | G1: 第4张 | H1: 第5张 | I1: 合计 | J1: 核算
A2: DeckLink Quad 2 | B2: 9922463 9922455 9922464 9922457 9922513 9922459 9922477 9922511 9922443 9922510 | C2: 10 | D2: 7 | H2: 3 | I2: =SUM(D2:H2) -> 10 | J2: =IF(I2=C2,"","错") -> 
A3: DeckLink 8K Pro | B3: 9716843 9716707 9716641 9716655 9716907 9716639 9716692 9716913 9716705 9716668 | C3: 10 | G3: 10 | I3: =SUM(D3:H3) -> 10 | J3: =IF(I3=C3,"","错") -> 
A4: UltraStudio HD Mini | B4: 9964658 9768317 9964689 9783857 | C4: 4 | H4: 4 | I4: =SUM(D4:H4) -> 4 | J4: =IF(I4=C4,"","错") -> 
A5: UltraStudio Recorder 3G | B5: 9934897 9934978 9934761 9934687 | C5: 4 | H5: 4 | I5: =SUM(D5:H5) -> 4 | J5: =IF(I5=C5,"","错") -> 
A6: Blackmagic PCIe Cable Kit | B6: 9241689 | C6: 1 | H6: 1 | I6: =SUM(D6:H6) -> 1 | J6: =IF(I6=C6,"","错") -> 
A7: Blackmagic URSA Mini Mic Mount | B7: 9620950 | C7: 1 | H7: 1 | I7: =SUM(D7:H7) -> 1 | J7: =IF(I7=C7,"","错") -> 
A8: Micro Converter HDMI to SDI 3G | B8: 9736766 9736765 9736804 9736789 9736786 9736637 9736770 9736792 9736758 9736764 9736787 9736635 9736784 9736650 9736783 9736790 9736821 9736795 9736631 9736648 | C8: 20 | G8: 2 | H8: 18 | I8: =SUM(D8:H8) -> 20 | J8: =IF(I8=C8,"","错") -> 
A9: Micro Converter SDI to HDMI 3G | B9: 9788450 9782388 9788454 9782383 9782391 9788499 9782380 9788453 9788488 9788440 9788468 9788446 9788451 9788496 9788452 9782358 9788495 9788456 9788466 9788447 | C9: 20 | H9: 20 | I9: =SUM(D9:H9) -> 20 | J9: =IF(I9=C9,"","错") -> 
A10: Teranex Mini - SDI to Audio 12G | B10: 9576854 9576847 9576902 9576834 | C10: 4 | H10: 4 | I10: =SUM(D10:H10) -> 4 | J10: =IF(I10=C10,"","错") -> 
A11: Teranex Mini - Quad SDI to 12G-SDI | B11: 9982812 9982792 9982804 9982849 | C11: 4 | E11: 2 | F11: 2 | I11: =SUM(D11:H11) -> 4 | J11: =IF(I11=C11,"","错") -> 
A12: Blackmagic MultiView 4 HD | B12: 9968968 9969227 9969066 9968972 | C12: 4 | H12: 4 | I12: =SUM(D12:H12) -> 4 | J12: =IF(I12=C12,"","错") -> 
A13: HyperDeck Studio HD Pro | B13: 9928311 9928364 9928348 | C13: 3 | H13: 3 | I13: =SUM(D13:H13) -> 3 | J13: =IF(I13=C13,"","错") -> 
A14: ATEM Constellation 8K | B14: 9926948 | C14: 1 | H14: 1 | I14: =SUM(D14:H14) -> 1 | J14: =IF(I14=C14,"","错") -> 
A15: ATEM 1 M/E Advanced Panel 10 | B15: 9965109 | C15: 1 | H15: 1 | I15: =SUM(D15:H15) -> 1 | J15: =IF(I15=C15,"","错") -> 
A16: ATEM 2 M/E Advanced Panel 20 | B16: 9965172 | C16: 1 | H16: 1 | I16: =SUM(D16:H16) -> 1 | J16: =IF(I16=C16,"","错") -> 
A17: Adapter - 3G BD SFP Optical Module | B17: 9783650 9782743 | C17: 2 | H17: 2 | I17: =SUM(D17:H17) -> 2 | J17: =IF(I17=C17,"","错") -> 
A18: Smart Videohub 40x40 | B18: 9806985 9807949 | C18: 2 | H18: 2 | I18: =SUM(D18:H18) -> 2 | J18: =IF(I18=C18,"","错") -> 
A19: Smart Videohub CleanSwitch 12x12 | B19: 9650676 | C19: 1 | H19: 1 | I19: =SUM(D19:H19) -> 1 | J19: =IF(I19=C19,"","错") -> 
A20: Videohub Master Control Pro | B20: 9790514 9790547 9790318 9790574 9790419 | C20: 5 | H20: 5 | I20: =SUM(D20:H20) -> 5 | J20: =IF(I20=C20,"","错") -> 