A1: 产品名称 | B1: 2022-6-21入库 未备注的均是货拉拉 | C1: 合计 | D1: 第1张 | E1: 第2张 | F1: 第3张 | G1: 第4张 | H1: 第5张 | I1: 合计 | J1: 核算
A2: DeckLink 8K Pro | B2: 9716817 9716803 9716906 9716909 9716910 9716890 9716815 9716879 9716891 9716844 | C2: 10 | D2: 10 | I2: =SUM(D2:H2) -> 10 | J2: =IF(I2=C2,"","错") -> 
A3: DeckLink Mini Monitor 4K | B3: 9325933 9325863 9325881 9325898 9325944 | C3: 5 | F3: 5 | I3: =SUM(D3:H3) -> 5 | J3: =IF(I3=C3,"","错") -> 
A4: DeckLink Mini Recorder | B4: 9431223 9431107 9431194 9431184 9431211 9431120 9431208 9431139 9431109 9431116 9431152 9431149 | C4: 12 | D4: 1 | G4: 11 | I4: =SUM(D4:H4) -> 12 | J4: =IF(I4=C4,"","错") -> 
A5: DeckLink Mini Recorder 4K | B5: 9546814 9546817 9546830 9546829 9546834 9546834 9546825 9546826 9546818 9546816 9546786 | C5: 10 | D5: 2 | G5: 8 | I5: =SUM(D5:H5) -> 10 | J5: =IF(I5=C5,"","错") ->  | K5: 录重
A6: UltraStudio 4K Mini | B6: 9708267 9708075 9710421 9708064 9708040 9710489 | C6: 6 | F6: 6 | I6: =SUM(D6:H6) -> 6 | J6: =IF(I6=C6,"","错") -> 
A7: UltraStudio Recorder 3G | B7: 9452114 9452335 9452380 9452346 9452212 9452352 9452219 9658051 9452198 9452337 9452339 9452335 | C7: 11 | G7: 11 | I7: =SUM(D7:H7) -> 11 | J7: =IF(I7=C7,"","错") ->  | K7: 录重
A8: Blackmagic Pocket Camera Battery Pro Grip | B8: 9622220 | C8: 1 | F8: 1 | I8: =SUM(D8:H8) -> 1 | J8: =IF(I8=C8,"","错") -> 
A9: Blackmagic URSA Mini Pro EF Mount | B9: 9507515 9507564 | C9: 2 | F9: 2 | I9: =SUM(D9:H9) -> 2 | J9: =IF(I9=C9,"","错") -> 
A10: Blackmagic URSA Broadcast G2 | B10: 9612994 | C10: 1 | F10: 1 | I10: =SUM(D10:H10) -> 1 | J10: =IF(I10=C10,"","错") -> 
A11: Blackmagic Focus Demand | B11: 9676184 9676180 | C11: 2 | F11: 2 | I11: =SUM(D11:H11) -> 2 | J11: =IF(I11=C11,"","错") -> 
A12: Blackmagic Zoom Demand | B12: 9706980 9706819 | C12: 2 | F12: 2 | I12: =SUM(D12:H12) -> 2 | J12: =IF(I12=C12,"","错") -> 
A13: Micro Converter BiDirectional SDI/HDMI 12G | B13: 9778094 9778098 | C13: 2 | G13: 2 | I13: =SUM(D13:H13) -> 2 | J13: =IF(I13=C13,"","错") -> 
A14: Micro Converter BiDirectional SDI/HDMI 12G wPSU | B14: 9923075 9923723 9923145 9923151 9923152 9923691 9923130 9923670 9923665 | C14: 9 | D14: 9 | I14: =SUM(D14:H14) -> 9 | J14: =IF(I14=C14,"","错") -> 
A15: Micro Converter HDMI to SDI 3G | B15: 9549001 9549049 | C15: 2 | G15: 2 | I15: =SUM(D15:H15) -> 2 | J15: =IF(I15=C15,"","错") -> 
A16: Micro Converter SDI to HDMI 3G | B16: 9788688 9788656 9788674 9788692 9788687 9788671 9788657 9788672 9788658 9788686 9788709 9788705 9788706 9788704 9788707 9788710 9788708 9788702 9788699 9788698 | C16: 20 | G16: 20 | I16: =SUM(D16:H16) -> 20 | J16: =IF(I16=C16,"","错") -> 
A17: Micro Converter SDI to HDMI 3G wPSU | B17: 9881788 9881578 9881520 9881789 9881783 | C17: 5 | H17: 5 | I17: =SUM(D17:H17) -> 5 | J17: =IF(I17=C17,"","错") -> 
A18: Mini Converter - SDI Distribution | B18: 9634962 9634975 9634972 9634986 9019031 9018886 | C18: 6 | G18: 6 | I18: =SUM(D18:H18) -> 6 | J18: =IF(I18=C18,"","错") -> 
A19: Teranex Mini - 12G-SDI to Quad SDI | B19: 9868186 9867596 | C19: 2 | E19: 2 | I19: =SUM(D19:H19) -> 2 | J19: =IF(I19=C19,"","错") -> 
A20: Teranex Mini - Rack Shelf | B20: 9361791 | C20: 1 | G20: 1 | I20: =SUM(D20:H20) -> 1 | J20: =IF(I20=C20,"","错") -> 
A21: Teranex AV | B21: 9873050 9872996 9637386 9637481 | C21: 4 | F21: 2 | G21: 2 | I21: =SUM(D21:H21) -> 4 | J21: =IF(I21=C21,"","错") -> 
A22: DaVinci Resolve Editor Keyboard | B22: 9915060 9906691 | C22: 2 | F22: 2 | I22: =SUM(D22:H22) -> 2 | J22: =IF(I22=C22,"","错") -> 
A23: Blackmagic Video Assist 7” 3G | B23: 9564219 | C23: 1 | G23: 1 | I23: =SUM(D23:H23) -> 1 | J23: =IF(I23=C23,"","错") -> 
A24: HyperDeck Studio 4K Pro | B24: 9841683 9841696 | C24: 2 | G24: 2 | I24: =SUM(D24:H24) -> 2 | J24: =IF(I24=C24,"","错") -> 
A25: ATEM 1 M/E Production Studio 4K | B25: 9703373 | C25: 1 | F25: 1 | I25: =SUM(D25:H25) -> 1 | J25: =IF(I25=C25,"","错") -> 
A26: ATEM 2 M/E Constellation HD | B26: 9892987 9886000 | C26: 2 | G26: 2 | I26: =SUM(D26:H26) -> 2 | J26: =IF(I26=C26,"","错") -> 
A27: ATEM Television Studio Pro 4K | B27: 9681858 快递收 | C27: 1 | E27: 1 | I27: =SUM(D27:H27) -> 1 | J27: =IF(I27=C27,"","错") -> 
A28: ATEM 1 M/E Advanced Panel 10 | B28: 9936898 | C28: 1 | I28: =SUM(D28:H28) -> 0 | J28: =IF(I28=C28,"","错") -> 错
A29: ATEM Camera Control Panel | B29: 9878935 | C29: 1 | F29: 1 | I29: =SUM(D29:H29) -> 1 | J29: =IF(I29=C29,"","错") -> 
A30: Adapter - 3G BD SFP Optical Module | B30: 9784232 9782675 9784679 9782894 | C30: 4 | G30: 4 | I30: =SUM(D30:H30) -> 4 | J30: =IF(I30=C30,"","错") -> 
A31: Videohub Master Control Pro | B31: 9790618 | C31: 1 | G31: 1 | I31: =SUM(D31:H31) -> 1 | J31: =IF(I31=C31,"","错") -> 
A32: Smart Videohub 20x20 | B32: 9708405 9708309 | C32: 2 | F32: 2 | I32: =SUM(D32:H32) -> 2 | J32: =IF(I32=C32,"","错") -> 
A33: Smart Videohub CleanSwitch 12x12 | B33: 9570431 | C33: 1 | G33: 1 | I33: =SUM(D33:H33) -> 1 | J33: =IF(I33=C33,"","错") -> 
A34: CABLE-BDLKMIR/SDI | B34: 9840161 9520775 | C34: 2 | F34: 2 | I34: =SUM(D34:H34) -> 2 | J34: =IF(I34=C34,"","错") -> 