A1: 产品名称 | B1: 2022-7-8入库 自提 | D1: 6.22 | E1: 4.26 | F1: 6.29 | G1: 5.30 | H1: 6.15 | I1: 6.7 | J1: 核算
A2: DeckLink Quad 2 | B2: 9922571 9922495 9922482 9922480 | C2: =LEN(B2)-LEN(SUBSTITUTE(B2," ",""))+1 -> 4 | F2: 4 | J2: =IF(C2=SUM(D2:I2),"对","错") -> 对
A3: DeckLink Quad HDMI Recorder | B3: 9970726 9970189 9970709 9970097 9970731 9970156 9970745 | C3: =LEN(B3)-LEN(SUBSTITUTE(B3," ",""))+1 -> 7 | F3: 7 | J3: =IF(C3=SUM(D3:I3),"对","错") -> 对
A4: DeckLink 8K Pro 15件 | B4: 10012563 10012552 10012780 9923545 9923589 9716642 9923580 10012783 9923554 9923533 10012647 9923582 9923606 | C4: =LEN(B4)-LEN(SUBSTITUTE(B4," ",""))+1 -> 13 | D4: 15 | J4: =IF(C4=SUM(D4:I4),"对","错") -> 错
A5: DeckLink 4K Extreme 12G | B5: 9871661 9871655 9871665 9871658 9871654 | C5: =LEN(B5)-LEN(SUBSTITUTE(B5," ",""))+1 -> 5 | H5: 5 | J5: =IF(C5=SUM(D5:I5),"对","错") -> 对
A6: DeckLink Mini Monitor 4K | B6: 9325753 9325952 9325865 9325922 9325619 | C6: =LEN(B6)-LEN(SUBSTITUTE(B6," ",""))+1 -> 5 | F6: 5 | J6: =IF(C6=SUM(D6:I6),"对","错") -> 对
A7: DeckLink Mini Recorder | B7: 9601374 9601379 9601368 | C7: =LEN(B7)-LEN(SUBSTITUTE(B7," ",""))+1 -> 3 | H7: 4 | J7: =IF(C7=SUM(D7:I7),"对","错") -> 错
A8: DeckLink Mini Recorder 4K | B8: 9546800 9979999 9546796 | C8: =LEN(B8)-LEN(SUBSTITUTE(B8," ",""))+1 -> 3 | F8: 3 | H8: 1 | J8: =IF(C8=SUM(D8:I8),"对","错") -> 错
A9: Blackmagic URSA Mini Pro 12K | B9: 10018750 | C9: =LEN(B9)-LEN(SUBSTITUTE(B9," ",""))+1 -> 1 | G9: 1 | J9: =IF(C9=SUM(D9:I9),"对","错") -> 对
A10: Blackmagic Focus Demand | B10: 9959823 9959887 | C10: =LEN(B10)-LEN(SUBSTITUTE(B10," ",""))+1 -> 2 | H10: 2 | J10: =IF(C10=SUM(D10:I10),"对","错") -> 对
A11: Blackmagic Zoom Demand | B11: 9930287 9930445 | C11: =LEN(B11)-LEN(SUBSTITUTE(B11," ",""))+1 -> 2 | H11: 2 | J11: =IF(C11=SUM(D11:I11),"对","错") -> 对
A12: Micro Converter BiDirectional SDI/HDMI 3G wPSU | B12: 9963837 9963875 9963876 9963882 9963350 9963874 9953307 9963390 9963797 9963779 | C12: =LEN(B12)-LEN(SUBSTITUTE(B12," ",""))+1 -> 10 | F12: 10 | J12: =IF(C12=SUM(D12:I12),"对","错") -> 对
A13: Micro Converter BiDirectional SDI/HDMI 12G wPSU | B13: 9971471 | C13: =LEN(B13)-LEN(SUBSTITUTE(B13," ",""))+1 -> 1 | H13: 1 | J13: =IF(C13=SUM(D13:I13),"对","错") -> 对
A14: Micro Converter HDMI to SDI 3G 40件 | B14: 10026374 10026375 10026377 10026378 10026384 10026385 10026386 10026387 10026388 10026396 10026416 10026417 10026418 10026419 10026420 10026426 10026427 10026428 10026429 10026430 10026862 10026861 10026912 10026830 10026827 10026858 10026891 10026859 10026863 10026831 10026834 10026890 10026894 10026898 10026893 10026909 10026829 10026860 10026828 10026908 | C14: =LEN(B14)-LEN(SUBSTITUTE(B14," ",""))+1 -> 40 | D14: 20 | F14: 2 | H14: 18 | J14: =IF(C14=SUM(D14:I14),"对","错") -> 对
A15: Micro Converter HDMI to SDI 3G wPSU | B15: 9894259 9894291 9894256 9893489 9893935 | C15: =LEN(B15)-LEN(SUBSTITUTE(B15," ",""))+1 -> 5 | F15: 5 | J15: =IF(C15=SUM(D15:I15),"对","错") -> 对
A16: Micro Converter SDI to HDMI 3G wPSU 10件 | B16: 9940868 9940875 9945307 9945242 9940553 9940658 9945241 9940846 9945337 9939285 | C16: =LEN(B16)-LEN(SUBSTITUTE(B16," ",""))+1 -> 10 | D16: 10 | J16: =IF(C16=SUM(D16:I16),"对","错") -> 对
A17: Micro Converter SDI to HDMI 12G wPSU 18件 | B17: 10026235 9862149 10026228 10026229 10026221 10026246 10026286 10026231 9862161 9862189 9862137 9969495 9862116 9862174 9862184 9969067 9969499 10026241 | C17: =LEN(B17)-LEN(SUBSTITUTE(B17," ",""))+1 -> 18 | F17: 8 | H17: 10 | J17: =IF(C17=SUM(D17:I17),"对","错") -> 对
A18: Mini Converter - SDI Distribution | B18: 9832537 | C18: =LEN(B18)-LEN(SUBSTITUTE(B18," ",""))+1 -> 1 | F18: 1 | J18: =IF(C18=SUM(D18:I18),"对","错") -> 对
A19: Teranex Mini - 12G-SDI to Quad SDI | B19: 9982409 | C19: =LEN(B19)-LEN(SUBSTITUTE(B19," ",""))+1 -> 1 | H19: 1 | J19: =IF(C19=SUM(D19:I19),"对","错") -> 对
A20: Blackmagic Cloud Pod | B20: 9844505 9844416 | C20: =LEN(B20)-LEN(SUBSTITUTE(B20," ",""))+1 -> 2 | H20: 2 | J20: =IF(C20=SUM(D20:I20),"对","错") -> 对
A21: Blackmagic Audio Monitor 12G 5件 | B21: 10036225 10036235 10036262 10036185 10036233 | C21: =LEN(B21)-LEN(SUBSTITUTE(B21," ",""))+1 -> 5 | D21: 1 | E21: 2 | I21: 2 | J21: =IF(C21=SUM(D21:I21),"对","错") -> 对
A22: Blackmagic MultiView 16 | B22: 9892058 | C22: =LEN(B22)-LEN(SUBSTITUTE(B22," ",""))+1 -> 1 | F22: 1 | J22: =IF(C22=SUM(D22:I22),"对","错") -> 对
A23: SmartView Duo 2 | B23: 9928848 | C23: =LEN(B23)-LEN(SUBSTITUTE(B23," ",""))+1 -> 1 | H23: 1 | J23: =IF(C23=SUM(D23:I23),"对","错") -> 对
A24: SmartScope Duo 4K 2 | B24: 9487936 9488028 | C24: =LEN(B24)-LEN(SUBSTITUTE(B24," ",""))+1 -> 2 | D24: 2 | J24: =IF(C24=SUM(D24:I24),"对","错") -> 对
A25: Blackmagic Video Assist 7” 3G | B25: 9851252 | C25: =LEN(B25)-LEN(SUBSTITUTE(B25," ",""))+1 -> 1 | D25: 1 | J25: =IF(C25=SUM(D25:I25),"对","错") -> 对
A26: Blackmagic Video Assist 7" 12G | B26: 10015883 10015620 10015572 | C26: =LEN(B26)-LEN(SUBSTITUTE(B26," ",""))+1 -> 3 | D26: 3 | J26: =IF(C26=SUM(D26:I26),"对","错") -> 对
A27: HyperDeck Studio HD Pro | B27: 10040012 | C27: =LEN(B27)-LEN(SUBSTITUTE(B27," ",""))+1 -> 1 | D27: 1 | J27: =IF(C27=SUM(D27:I27),"对","错") -> 对
A28: HyperDeck Studio 4K Pro | B28: 10035007 10035028 10035415 10035372 | C28: =LEN(B28)-LEN(SUBSTITUTE(B28," ",""))+1 -> 4 | D28: 4 | J28: =IF(C28=SUM(D28:I28),"对","错") -> 对
A29: ATEM Mini Pro 8件 | B29: 9891098 9890735 9890669 9891089 9891197 9890745 9891188 9890747 | C29: =LEN(B29)-LEN(SUBSTITUTE(B29," ",""))+1 -> 8 | I29: 8 | J29: =IF(C29=SUM(D29:I29),"对","错") -> 对
A30: ATEM 1 M/E Advanced Panel 10 | B30: 9963836 | C30: =LEN(B30)-LEN(SUBSTITUTE(B30," ",""))+1 -> 1 | D30: 1 | J30: =IF(C30=SUM(D30:I30),"对","错") -> 对