A1: 序号 | B1: 名称 | C1: 序列号 | D1: 件数 | E1: 出库人 | F1: 收件人 | G1: 电话 | H1: 快递费用 | I1: 运费 | J1: 运单号 | K1: 日期 | L1: 备注
A2: 1. | B2: ATEM Mini | C2: 6209019 | D2: 1 | E2: 王艺兴 | F2: 杨力 | G2: 18001215855 | H2: 京东 | J2: JDVA017 | K2: 2020-2-1 | L2: 京东
A3: =MAX($A$1:$A2)+1 -> 2. | B3: DeckLink Mini Monitor 4K | C3: 6087915 | D3: 1 | E3: 王艳霞 | F3: 岩晓 | G3: 13988226111 | H3: 顺丰标快 | J3: 263235918624 | K3: 2020-2-3 | L3: 寄付现结
A4: =MAX($A$1:$A3)+1 -> 3. | B4: BlackMagic Pocket Cinema Camera 4K | C4: 6126929 | D4: 1 | E4: 王增杰 | F4: 龚沙 | G4: 13631204979 | H4: 京东陆运 | J4: JDX001142204543 | K4: 2020-2-4 | L4: 代李东发
A5: =MAX($A$1:$A4)+1 -> 4. | B5: BlackMagic Pocket Cinema Camera 4K | C5: 6119854 | D5: 1 | E5: 王艺兴 | F5: 曹靖宇 | G5: 15561468618 | H5: 京东 | J5: JDVA01722478074 | K5: 2020-2-5 | L5: 京东
A6: =COUNT($A$2:A5)+1 -> 5. | B6: Blackmagic eGPU Pro | C6: 05426285 | D6: 1 | E6: 王艳霞 | F6: 李静 | G6: 86-18601033431 | H6: 顺丰 | J6: 263235918633 | K6: 2020-2-6
B7: DaVinci Resolve Dongle 16 | C7: 6092795 | D7: 1 | E7: 王艺兴 | F7: 王淑娟 | G7: 13938565567 | H7: 京东 | J7: JDVA01726945368 | K7: 2020-2-6 | L7: 京东
A8: =COUNT($A$2:A6)+1 -> 6. | B8: AZDEN PRO-XR | D8: 1 | E8: 王艺兴 | F8: 严晓蕾 | G8: 18682590898 | H8: 京东 | J8: SF1071226465556 | K8: 2020-2-10 | L8: 张云雷直发
A9: =COUNT($A$2:A8)+1 -> 7. | B9: intensity pro 4k | C9: 6174037 6174193 6174172 6175426 6174005 | D9: 5 | E9: 王增杰 | F9: 张凤娣 | G9: 13366912460 | H9: 顺丰到付 | J9: 263235918660 | K9: 2020-2-11 | L9: 张凤娣
B10: Decklink DUO 2 | C10: 6102539 6102527 | D10: 2
A11: =COUNT($A$2:A10)+1 -> 8. | B11: UR242 | C11: CHNEZK01077 | D11: 1 | E11: 王增杰 | F11: 刘赞赞 | G11: 18810358486 | H11: 自提 | K11: 2020-2-11 | L11: 对公已收款 货票同行
B12: MPB730 HDMI | D12: 1
A13: =COUNT($A$2:A12)+1 -> 9. | B13: Decklink DUO 2 | C13: 6204550 | D13: 1 | E13: 王增杰 | F13: 赵军 | G13: 16619922900 | H13: 顺丰垫付 | I13: 13 | J13: 263235918679 | K13: 2020-2-11 | L13: 代张凤娣发，运费已付
A14: =COUNT($A$2:A13)+1 -> 10. | B14: cable-HDMI DeckLink Micro Recorder | C14: 5259213 | D14: 1 | E14: 王艺兴 | F14: 李治国 | G14: 13544237320 | H14: 顺丰陆运 | K14: 2020-2-11 | L14: 淘宝 美丽
B15: cable-SDI DeckLink Micro Recorder | C15: 5535766 | D15: 1
A16: =COUNT($A$2:A15)+1 -> 11. | B16: DeckLink Studio 4K | C16: 6223742 6259861 6223970 | D16: 3 | E16: 王增杰 | F16: 平广峰 | G16: 133-3100-1597 | H16: 顺丰到付 | J16: 263235918688 | K16: 2020-2-12 | L16: 代陈莉发，未付款
A17: =COUNT($A$2:A16)+1 -> 12. | B17: Teranex Mini HDMI to SDI 12G | C17: 6201150 5898215 | D17: 2 | E17: 王增杰 | F17: 刘勇 | G17: 13911559124 | H17: 顺丰寄付 | J17: 263235918697 | K17: 2020-2-12 | L17: 票货同行，对公已收款
A18: =COUNT($A$2:A17)+1 -> 13. | B18: DaVinci Resolve dongle 16 | C18: 6092977 | D18: 1 | E18: 王增杰 | F18: 黎明 | G18: 18646664762 | H18: 顺丰寄付 | I18: 18 | J18: 263235918702 | K18: 2020-2-12 | L18: 代张凤娣发
A19: =COUNT($A$2:A18)+1 -> 14. | B19: L-5.5CUHD | C19: 2m做头 | D19: 1 | E19: 王艺兴 | F19: 倪雅飞 | G19: 13916202109 | H19: 京东 | J19: JDVA01764482218 | K19: 2020-2-12 | L19: 京东
A20: =COUNT($A$2:A19)+1 -> 15. | B20: ATEM MINI | C20: 6232958 | D20: 1 | E20: 王艺兴 | F20: 陈车 | G20: 13426023124 | H20: 顺丰寄付 | J20: 263235918711 | K20: 2020-2-12 | L20: 淘宝美丽
B21: HDMI线 | D21: 1
A22: =COUNT($A$2:A21)+1 -> 16. | B22: DaVinci resolve 16 | C22: 6083077 | D22: 1 | E22: 王增杰 | F22: 张维平 | G22: 15104695896 | H22: 顺丰寄付 | I22: 20 | J22: 263235918720 | K22: 2020-2-13 | L22: 代李东发 运费一起算 已清
A23: =COUNT($A$2:A22)+1 -> 17. | B23: Micro Converter HDMI to SDI | C23: 5990174+5990189 | D23: 2 | E23: 王艺兴 | F23: 李鹏伟 | G23: 18538600166 | H23: 京东航空寄付 | J23: JDX001176430793 | K23: 2020-2-14 | L23: 腾勇 佳杰对公已付款
A24: =COUNT($A$2:A23)+1 -> 18. | B24: Micro Converter SDI to HDMI | C24: 6107331 | D24: 1 | E24: 王艺兴 | F24: 阳光-阿特-吉日嘎拉 | G24: 15048901444 | H24: 顺丰航空到付 | J24: 263235918739 | K24: 2020-2-14 | L24: 腾勇 佳杰对公已付款
A25: =COUNT($A$2:A24)+1 -> 19. | B25: micro converter BiDirectional SDI/HDMI | C25: 5697376 | D25: 1 | E25: 王艺兴 | F25: 任峰 | G25: 13789808736 | H25: 京东快递 | J25: JDX001176577663 | K25: 2020-2-14 | L25: 淘宝美丽
A26: =COUNT($A$2:A25)+1 -> 20. | B26: Decklink Duo 2 | C26: 6201634 | D26: 1 | E26: 王超飞 | F26: 胡希宇 | G26: 18611782066 | H26: 京东到付 | J26: JDX001176813150 | K26: 2020-2-14 | L26: 对公已付
B27: Decklink Mini Monitor | C27: 6236189 | D27: 1
A28: =COUNT($A$2:A26)+1 -> 21. | B28: ultrastudio mini recorder | C28: 5817399 | D28: 1 | E28: 王艳霞 | F28: 冯凌飞 | G28: 13888118123 | H28: 顺丰航空 | K28: 2020-2-15
A29: =COUNT($A$2:A28)+1 -> 22. | B29: UltraStudio Mini Recorder | C29: 5817391 5817378 | D29: 2 | E29: 王艳霞 | F29: 张先生 | G29: 13488659216 | H29: 顺丰寄付 | J29: 263235918748 | K29: 2020-2-16
A30: =COUNT($A$2:A29)+1 -> 23. | B30: ATEM MINI | C30: 6211843 | D30: 1 | E30: 王艺兴 | F30: 戴祥 | G30: 13146378401 | H30: 顺丰到付 | J30: 263235918757 | K30: 2020-2-17
A31: =COUNT($A$2:A30)+1 -> 24. | B31: UltraStudio Mini Recorder | C31: 5817366 | D31: 1 | E31: 王艺兴 | F31: 于祥国 | G31: 13911700596 | H31: 顺丰寄付 | J31: 263235918766 | K31: 2020-2-17 | L31: 腾勇 对公晚会付款
A32: =COUNT($A$2:A31)+1 -> 25. | B32: ATEM Mini | C32: 6208844+6233150 | D32: 2 | E32: 王增杰 | F32: 刘志 | G32: 13524151381 | H32: 顺丰到付 | J32: 263235918775 | K32: 2020-2-17 | L32: 对公已收款，货票同行
A33: =COUNT($A$2:A32)+1 -> 26. | B33: SGM-990+i | D33: 1 | E33: 王艺兴 | F33: 邱文鹤 | G33: 13620229622 | H33: 京东快递 | J33: JDVA01794286867 | K33: 2020-2-17 | L33: 京东
A34: =COUNT($A$2:A33)+1 -> 27. | B34: UltraStudio Mini Recorder | C34: 5817422 | D34: 1 | E34: 王艺兴 | F34: 欧锦钊 | G34: 13711086490 | H34: 顺丰陆运 寄付 | J34: 263235918784 | K34: 2020-2-17 | L34: 淘宝美丽
B35: UltraStudio Mini Monitor | C35: 5878576 | D35: 1
A36: =COUNT($A$2:A35)+1 -> 28. | B36: UltraStudio Mini Recorder | C36: 5976001 | D36: 1 | E36: 王艺兴 | F36: 夏影 | G36: 18620357500 | H36: 顺丰寄付 | J36: 263235918818 | K36: 2020-2-18 | L36: 京东
B37: 雷电三转二 | D37: 1
B38: 散装雷电线 | D38: 1
B39: HDMI线 | D39: 1
B40: HyperDeck Studio Pro 2 | C40: 6004917 | D40: 1 | E40: 王增杰 | F40: 罗廉政 | G40: 138 7495 7889 | H40: 顺丰寄付 | J40: 263235918793 | K40: 2020-2-19 | L40: 货票同行
B41: DeckLink Mini Monitor 4K | C41: 6088065 | D41: 1 | E41: 王艺兴 | F41: 朱奇发 | G41: 15153192306 | H41: 京东 | J41: JDVA01811106620 | K41: 2020-2-20 | L41: 京东
B42: HDMI线 | D42: 1
B43: GMS-990-i | D43: 1 | E43: 王艺兴 | F43: 杨晴宁 | G43: 13552069917 | H43: 顺丰航空寄付 | J43: 263235918827 | K43: 2020-2-20 | L43: 京东
B44: Teranex mini HDMI to SDI 12G | C44: 6201310 | D44: 1 | E44: 王增杰 | F44: 王红茹 | G44: 13152062652 | H44: 顺/航/寄 | I44: 33 | J44: SF1008019583482 | K44: 2020-2-20 | L44: 代张凤娣发 未付款
B45: Teranex mini SDI to HDMI 12G | C45: 6172948 | D45: 1
B46: ATEM 2 M/E Broadcast Studio 4K | C46: 4692380 | D46: 1 | E46: 王延雷 | F46: 瑞城口腔 | H46: 送货 | K46: 2020-2-20 | L46: 瑞城口腔
B47: Decklink mini monitor | C47: 6235811 | D47: 1 | E47: 王艺兴 | F47: 卢征 | G47: 13630002139 | H47: 京东快递 | J47: JDVA01818714075 | K47: 2020-2-21 | L47: 京东
B48: HDMI线 | D48: 1
B49: 数字版调色软件 | C49: 6082949 | D49: 1 | E49: 王艺兴 | F49: 姜先生 | G49: 13601226568 | H49: 京东快递 | J49: JDVA01820841585 | K49: 2020-2-21 | L49: 京东
B50: ultrastudio mini recorder | C50: 5613222 | D50: 1 | E50: 王艳霞 | F50: 潘 | H50: 顺丰到付 | J50: 263235918836 | K50: 2020-2-21
B51: Micro Converter BiDirectional SDI/HDMI wPSU | C51: 6185220 6081875 | D51: 2 | E51: 王艺兴 | F51: 孙杰 | G51: 13891089959 | H51: 顺丰寄付 | J51: 263235920911 | K51: 2020-2-21 | L51: 陕西瑞金电子 对公
B52: ATEM Television Studio Pro 4K | C52: 6159748 | D52: 1
B53: UltraStudio Mini Recorder | C53: 5884983 | D53: 1 | E53: 王艺兴 | F53: 张阳 | G53: 18698680587 | H53: 顺丰航空到付 | J53: 263235920920 | K53: 2020-2-21 | L53: 淘宝美丽 未税
B54: Blackmagic Camera Fiber Converter | C54: 5420091 | D54: 1 | E54: 王延雷 | F54: 陈华 | G54: 13008015252 | H54: 顺丰寄付 | J54: 263235918845 | K54: 2020-2-21 | L54: 运城
B55: Blackmagic Studio Camera 4K | C55: 5900646 | D55: 1 | E55: 王艺兴 | F55: 郭蕊 | G55: 18647722903 | H55: 京东到付 | J55: JDX001199354100 | K55: 2020-2-21 | L55: 德文兴业 对公杰明
B56: URSA Mini B4 Mount | C56: 2840308 | D56: 1
B57: 兰帕特云台DB-15-L | D57: 1 | E57: 王艺兴 | F57: 郭蕊 | G57: 18647722903 | H57: 顺丰到付 | J57: SF1017884921608 | K57: 2020-2-21 | L57: 厂家直发
B58: Micro Converter HDMI to SDI | C58: 5990133 5990180 | D58: 2 | E58: 王艺兴 | F58: 孟强民 | G58: 18298628106 | H58: 顺丰陆运寄付 | J58: 263235920939 | K58: 2020-2-21 | L58: 淘宝美丽未税
B59: AZDEN SGM-990+i | D59: 1 | E59: 王艺兴 | F59: 赵秋实 | G59: 13133557749 | H59: 顺丰 | K59: 2020-2-23 | L59: 张云雷直发
B60: 雷电二散装线 | D60: 2 | E60: 王艺兴 | F60: 张凤娣 | H60: 闪送 张凤娣下单 | K60: 2020-2-23 | L60: 未付款
B61: UltraStudio HD Mini | C61: 5698567 | D61: 1 | E61: 王艳霞 | F61: 郭经纬 | G61: 17600809143 | H61: 闪送 | I61: 46 | K61: 2020-2-23 | L61: 代腾勇闪送
B62: 雷电3线 | D62: 1
B63: BDP-B53 | C63: 100/盒 | D63: 2盒 | E63: 王增杰 | F63: 东奥 | H63: 送货 | K63: 2020-2-24 | L63: 东奥施工
B64: TS100C | D64: 1
B65: TCD-1 | D65: 1
B66: TCD-35CA | D66: 1
B67: intensity shuttle USB3.0 | C67: 6091459 | D67: 1 | E67: 王艺兴 | H67: 顺丰寄付 | J67: 263235920957 | K67: 2020-2-24 | L67: 换货
B68: Ultrastudio mini recorder | C68: 5613086 | D68: 1 | E68: 王艺兴 | F68: 刘怀 | G68: 13308036403 | H68: 顺丰航空到付 | J68: 263235918872 | K68: 2020-2-24 | L68: 淘宝美丽未税
B69: DeckLink Mini Monitor | C69: 6235805 | D69: 1 | E69: 王增杰 | F69: 陆芳 | G69: 18612705707 | H69: 顺丰到付 | J69: 263235918881 | K69: 2020-2-24 | L69: 新海蓝点对公
B70: UltraStudio Mini Monitor | C70: 5922626 | D70: 1 | E70: 王艺兴 | F70: 欧阳智斌 | G70: 18689266818 | H70: 京东 | J70: JDVA01846262544 | K70: 2020-2-24 | L70: 京东
B71: mini Converter SDI to Audio 4K | C71: 5744061 5792445 | D71: 2 | E71: 王艺兴 | F71: 孙杰 | G71: 13891089959 | H71: 顺丰航空寄付 | J71: 263235919107 | K71: 2020-2-24 | L71: 对公
B72: MINI Converter Optical Fiber 12G | C72: 6037747 6037725 6130606 6037748 6030785 6117390 | D72: 6 | E72: 王增杰 | F72: 张凤娣 | H72: 顺丰 | I72: 17 | J72: 263235918890 | K72: 2020-2-25 | L72: 未付款
B73: 3G BD SFP | C73: 6229675 5653280 5653320 5653240 6232174 5653300 | D73: 6
B74: eGPU Pro | C74: 05504829 | D74: 1 | E74: 王艺兴 | F74: 林先生 | G74: 13825050491 | H74: 京东快递 | J74: JDVA01853918231 | K74: 2020-2-25 | L74: 京东
B75: EGPU PRO | C75: 06111605 | D75: 1 | E75: 王艺兴 | F75: 谭伟柏 | G75: 15992453735 | H75: 京东快递 | J75: JDVA01856095009 | K75: 2020-2-26 | L75: 京东
B76: Mini Converter SDI to Audio | C76: 6189143 6189145 | D76: 2 | E76: 王艺兴 | F76: 沈易 | G76: 18915596869 | H76: 京东快递 | J76: JDVA01857093862 | K76: 2020-2-26 | L76: 京东
B77: Mini Converter Audio to SDI | C77: 6099055 6099392 | D77: 2
B78: BlackMagic Pocket Cinema Camera 6K | C78: 5981360 5978111 | D78: 2 | E78: 王增杰 | F78: 李东 | G78: 13371725861 | H78: 顺丰到付 | J78: 263235918915 | K78: 2020-2-26 | L78: 已付款
B79: mini Converter UPdownCross HD | C79: 6241256 | D79: 1 | E79: 王艺兴 | F79: 孟强民 | G79: 18298628106 | H79: 顺丰 | J79: 263235918906 | K79: 2020-2-26 | L79: 淘宝美丽
B80: L-5.5CUHD | C80: 1m做头 | D80: 3 | E80: 王艺兴 | F80: 周旭冉 | G80: 18629305081 | H80: 京东 | J80: JDVA01860982394 | K80: 2020-2-26 | L80: 京东
C81: 2m做头 | D81: 3
B82: Mini Converter HDMI to SDI 6G | C82: 5974395 | D82: 1 | E82: 王增杰 | F82: 谭建明 | G82: 13869398691 | H82: 顺丰垫付 | I82: 21 | J82: 263235918924 | K82: 2020-2-27 | L82: 诚润 金玉璋 代发（未付款） | M82: 运费已付
B83: Mini Converter UpDownCross HD | C83: 6241249+6164926 | D83: 2
B84: Decklink mini Recorder | C84: 5228715+6072252 | D84: 2 | E84: 王延雷 | F84: 东奥 | H84: 送货 | K84: 2020-2-27 | L84: 东奥组装电脑 装机
B85: 长城600W电源 | D85: 2
B86: 双卡王电源 | D86: 1
B87: 影驰GEFORCE GTX1050Ti显卡 | D87: 2
B88: ZOTAC显卡 | D88: 1
B89: B365M AORUS主板 | D89: 3
B90: i5-9400F | D90: 1
B91: i7-9700F | D91: 2
B92: ST2000DM008 | C92: 2T机械硬盘 | D92: 1
B93: ST4000DM004 | C93: 4T机械硬盘 | D93: 2
B94: 闪迪240G固态硬盘 | D94: 2
B95: 4G内存条 | D95: 4
B96: 8G内存条 | D96: 4
B97: 16G内存条 | D97: 2
B98: 航嘉机箱 | D98: 3
B99: 罗技键鼠 | D99: 3套
B100: Genius CG 卡 | D100: 1
B101: 字幕软件 | D101: 1
B102: L-5.5CUHD | C102: 1米做头 | D102: 8 | E102: 王艺兴 | F102: 张卫花(丁飞) | G102: 13730996048 | H102: 京东 | J102: jdx001221382680 | K102: 2020-2-28 | L102: 对公已付
B103: L-5.5CUHD | C103: 2米做头 | D103: 8
B104: L-3.3CUHD | C104: 2米做头 | D104: 8
B105: Mini converter Audio to sdi 4k | C105: 5500426+5616750 | D105: 2 | E105: 王艺兴 | F105: 孙杰 | G105: 13891089959 | H105: 顺丰航空寄付 | K105: 2020-2-28 | L105: 对公
B106: SGM-990+I | D106: 1 | E106: 王艺兴 | F106: 白茹娜 | G106: 13521165615 | H106: 厂家直发 | J106: SF1071226465459 | K106: 2020-2-28 | L106: 张云雷直发
B107: ATEM MINI | C107: 6233227 | D107: 1 | E107: 王艺兴 | F107: 曾雄杰 | G107: 13581690458 | H107: 京东 | J107: JDVA01884431239 | K107: 2020-2-29 | L107: 京东