A1: 序号 | B1: 名称 | C1: 序列号 | D1: 件数 | E1: 出库人 | F1: 收件人 | G1: 电话 | H1: 快递费用 | I1: 运费 | J1: 运单号 | K1: 日期 | L1: 备注
A2: =COUNT($A$1:A1)+1 -> 1 | B2: L-2B2AT | D2: 2 | E2: 王增杰 | F2: 王红星 | H2: 自提 | K2: 2020-1-1 | L2: 未付款
B3: L-4.5CHD+ | D3: 1
A4: =COUNT($A$1:A3)+1 -> 2 | B4: Decklink QUAD 2 | C4: 5749461 | D4: 1 | E4: 王增杰 | F4: 张银鸽 | G4: 13572481591 | H4: 顺丰到付 | J4: SF1082052672281 | K4: 2020-1-1 | L4: 未付款
B5: Decklink Mini Monitor | C5: 6195157,6195193 | D5: 2
A6: =COUNT($A$1:A5)+1 -> 3 | B6: L-2.5CHD+ | C6: BNC转DIN 1m做头 | D6: 9
B7: 三排十五针公 | D7: 2 | F7: 前线 | H7: 送货 | K7: 2020-1-2
A8: =COUNT($A$1:A7)+1 -> 4 | B8: 双排二十五针公 | D8: 1
B9: 三排26针 | D9: 1
A10: =COUNT($A$1:A9)+1 -> 5 | B10: DaVinci Resolve Mini Panel | C10: 6220664 | D10: 1 | E10: 王增杰 | F10: 张宝志 | G10: 18304766868 | H10: 顺丰到付 | J10: SF1082052672493 | K10: 2020-1-2 | L10: 对公已收款（源松捷 孙昭阳）
B11: DaVinci Resolve Studio | C11: 5759949 | D11: 1
A12: =COUNT($A$1:A11)+1 -> 6 | B12: Mini Converter Audio to SDI 4K | C12: 5451736 | D12: 1 | E12: 王艺兴 | F12: 王倩儒 | G12: 17600255859 | H12: 京东 | J12: JDVA01487794846 | K12: 2020-1-2 | L12: 京东
A13: =COUNT($A$1:A12)+1 -> 7 | B13: HyperDeck Studio Pro | C13: 6004855 | D13: 1 | E13: 王艺兴 | F13: 王丽 | G13: 13810700406 | H13: 京东 | J13: JDX001067969758 | K13: 2020-1-2 | L13: 对公
A14: =COUNT($A$1:A13)+1 -> 8 | B14: DaVinci Resolve Studio Dogle | C14: 6092780,5943988 | D14: 2 | E14: 王增杰 | F14: 王传宁 | G14: 18911898988 | H14: 顺丰到付 | J14: SF1082052672290 | K14: 2020-1-2 | L14: 对公已办款，票随货发
A15: =COUNT($A$1:A14)+1 -> 9 | B15: Decklink DUO 2 | C15: 6103225 | D15: 1 | E15: 王增杰 | F15: 吴超 | G15: 13671375820 | H15: 京东 | K15: 2020-1-2 | L15: 惠买 未付款
A16: =COUNT($A$1:A15)+1 -> 10 | B16: Blackmagic URSA Mini SSD Recorder | C16: 5534565 | D16: 1 | E16: 王增杰 | F16: 贾老师 | H16: 对方闪送 | K16: 2020-1-2 | L16: 货票同行 企业支付宝收款
A17: =COUNT($A$1:A16)+1 -> 11 | B17: ADX-LED-3256B | D17: 1 | E17: 王艺兴 | F17: 牙生 | G17: 18977184661 | H17: 顺丰ADX直发 | K17: 2020-1-2 | L17: ADX代发
A18: =COUNT($A$1:A17)+1 -> 12 | B18: 1SKB-R6W | D18: 1 | E18: 王延雷 | F18: 运城 | H18: 京东 | K18: 2020-1-2
A19: =COUNT($A$1:A18)+1 -> 13 | B19: ATEM Television Studio HD | C19: 5987594 | D19: 1 | E19: 王延雷 | F19: 横店 | H19: 送货 | K19: 2020-1-2
B20: HyperDeck Studio Mini | C20: 6064534 6131244 6131191 | D20: 3
B21: Ultimatte 11 | C21: 4865910 4116281 4284402 | D21: 2
B22: 1SKB-R6U | D22: 1
B23: 罗技无线键鼠 | D23: 1
B24: L-2.5CHD+ | C24: 1m做头 | D24: 6
B25: 2B2AT | C25: 甬声卡侬公母3m做头 | D25: 2
B26: 电源线 | D26: 7
B27: Micro Converter SDI to HDMI | C27: 6107316+6107306 | D27: 2
A28: =COUNT($A$1:A27)+1 -> 14 | B28: 电源线 | D28: 2 | F28: 前线 | H28: 送货 | K28: 2020-1-2
B29: HDMI-DVI转换头 | D29: 2
B30: YS551 | D30: 4
B31: 国产视频座 | D31: 2
B32: 接口板 | D32: 2
B33: 绑线杆 | D33: 1
B34: 二排25针母 | D34: 1
B35: USB电源线 | D35: 4
B36: Micro Converter SDI to HDMI | C36: 6107349 6107331 6107346 6107340 | D36: 4
B37: HDMI长线（测试） | D37: 2
A38: =COUNT($A$1:A37)+1 -> 15 | B38: TS-100U | D38: 1 | E38: 王艺兴 | F38: 彭波 | G38: 15680530285 | H38: 京东 | K38: 2020-1-3 | L38: 杰明普票随货
B39: TC-1 | D39: 1
B40: TCD-451CA | D40: 1
B41: L-4CFB+ | D41: 1箱
B42: BCP-B4F | D42: 100
A43: =COUNT($A$1:A42)+1 -> 16 | B43: intensity Pro 4K | C43: 5936506 5936523 5936888 5898966 6175590 6175606 | D43: 6 | E43: 王艺兴 | F43: 孙超 | G43: 18600441357 | H43: 京东快递 | K43: 2020-1-3 | L43: 北京宇正恒创 对公
A44: =COUNT($A$1:A43)+1 -> 17 | B44: Micro Converter BiDirectional SDI/HDMI wPSU | C44: 6083760 6082777 | D44: 2 | E44: 王艺兴 | F44: 陈长军 | G44: 13558832981 | H44: 京东 | K44: 2020-1-3 | L44: 京东
A45: =COUNT($A$1:A44)+1 -> 18 | B45: URSA Mini SSD Recorder | C45: 6237387 | D45: 1 | E45: 王增杰 | H45: 对方下闪送 | K45: 2020-1-3 | L45: 货票同行 普票
A46: =COUNT($A$1:A45)+1 -> 19
A47: =COUNT($A$1:A46)+1 -> 20 | B47: ATEM Mini | C47: 6209426 | D47: 1 | E47: 王延雷 | F47: 赵老师 | G47: 13693340620 | H47: 京东 | J47: JDX001071924081 | K47: 2020-1-3 | L47: 对公货票同行
B48: Micro Converter SDI to HDMI wPSU | C48: 6209806 6146267 6145285 6145280 6146286 6146321 | D48: 6
B49: YS122 | C49: 卡侬公转大三芯公 | D49: 6
B50: 4E5AT | C50: 10m做头卡侬共转母 | D50: 6
A51: =COUNT($A$1:A50)+1 -> 21 | B51: 伺服器MS-11 | D51: 3 | E51: 王延雷 | F51: 运城 | H51: 京东重货 | K51: 2020-1-3 | L51: 转播车项目
B52: MS-X1 | D52: 1
A53: =COUNT($A$1:A52)+1 -> 22 | B53: YS177 | D53: 15 | E53: 王延雷 | F53: 王延雷 | G53: 13522629785 | H53: 京东 | J53: JDX001074712111 | K53: 2020-1-4 | L53: 郑州
B54: YS176 | D54: 15
B55: YS202D | D55: 10
B56: YS231L | D56: 2
B57: YS145 | D57: 5
B58: YS146 | D58: 5
B59: 佳耐美网线 | D59: 133m
B60: 网座双通 | D60: 2
B61: 16口接口板 | C61: 带螺丝 | D61: 1
B62: PDU | D62: 1
B63: 绕线管 | D63: 3包
A64: =COUNT($A$1:A63)+1 -> 23 | B64: Decklink 8K Pro | C64: 6160663 | D64: 1 | E64: 王艺兴 | F64: 朱庆凤 | G64: 13817040537 | H64: 顺丰航空寄付 | J64: SF1082083761261 | K64: 2020-1-5 | L64: 京东
A65: =COUNT($A$1:A64)+1 -> 24 | B65: Decklink Mini Monitor | C65: 6236557 6236542 6236507 6236558 6235591 | D65: 5 | E65: 王增杰 | F65: 魏艳杰 | G65: 13315427413 | H65: 顺丰到付 | J65: SF1082083761270 | K65: 2020-1-5 | L65: 代何忠明 未付款
A66: =COUNT($A$1:A65)+1 -> 25 | B66: Decklink Mini Monitor | C66: 6236578 | D66: 1 | E66: 王艺兴 | F66: 邹晓钦 | G66: 15071177838 | H66: 京东快递 | J66: JDVA01514665007 | K66: 2020-1-5 | L66: 京东
A67: =COUNT($A$1:A66)+1 -> 26 | B67: L-4E6S | C67: 1m卡侬公转母 | D67: 1 | E67: 王艺兴 | F67: 高占平 | G67: 13309625915 | H67: 顺丰到付 | J67: SF1082083761289 | K67: 2020-1-5 | L67: 换 差价已补
A68: =COUNT($A$1:A67)+1 -> 27 | B68: AJA U-TAP SDI | D68: 1 | E68: 王艺兴 | F68: Andrzej | G68: 15801697353 | H68: 京东 | J68: JDVA01520328562 | K68: 2020-1-6 | L68: 京东
A69: =COUNT($A$1:A68)+1 -> 28 | B69: Mini Converter SDI to Audio | C69: 6067726 6050212 | D69: 2 | E69: 王增杰 | F69: 许晶 | G69: 15248152913 | H69: 顺丰到付 | J69: SF1082083761313 | K69: 2020-1-6 | L69: 货票同行 对公已收款
A70: =COUNT($A$1:A69)+1 -> 29 | B70: Decklink Duo 2 | C70: 6201700 | D70: 1 | E70: 王艳霞 | F70: 张炜 | G70: 13773000019 | H70: 中通 | J70: 640160175262 | K70: 2020-1-6
A71: =COUNT($A$1:A70)+1 -> 30 | B71: SONY PXW-X580 | C71: 0053518 | D71: 1 | E71: 王增杰 | F71: 郭强 | G71: 18805365711 | H71: 顺丰陆运 | J71: SF1082082761304 | K71: 2020-1-6 | L71: 奎文演播室
B72: SXS 64G存储卡 | D72: 1
B73: BP130S电池 | D73: 1
B74: VCT-14专业摄像机托板 | D74: 1
B75: ZA2*4.5BRM 镜头 | D75: 1
B76: 富威德 G70 | D76: 2
B77: 小米增强智能摄像机 | C77: +C9064G Micro SD卡 | D77: 2
B78: ATEM Television Studio Pro HD | C78: 5703082 | D78: 1
B79: Micro Converter SDI to HDMI wPSU | C79: 6146442 6145662 6146279 6094450 | D79: 4
B80: YAMAHA MG12XU | D80: 1
B81: HYPUS CM4 | D81: 2
B82: 森海塞尔 Hd280Pro | D82: 1
B83: BMD Mini Converter SDI Distribution | C83: 5981010 | D83: 1
B84: BMD Micro Converter SDI to HDMI | C84: 5987530 5987521 5987518 6107298 5987529 5987520 5987528 5987527 5987460 5987519 5987534 5987536 | D84: 12
B85: video splitter 8*8矩阵 | D85: 1
A86: =COUNT($A$1:A85)+1 -> 31 | B86: Mini Converter Analog to SDI | C86: 6061098 | D86: 1 | E86: 王艺兴 | F86: 李华 | G86: 13980699316 | H86: 顺丰 | J86: SF1082083761298 | K86: 2020-1-6 | L86: 淘宝美丽
A87: =COUNT($A$1:A86)+1 -> 32 | B87: L-5DFB | C87: 多半箱 | D87: 1 | E87: 王增杰 | F87: 小杨 | H87: 送货 | K87: 2020-1-6 | L87: 前线
A88: =COUNT($A$1:A87)+1 -> 33 | B88: Decklink 4K Extreme 12G | C88: 6162304 | D88: 1 | E88: 王艺兴 | F88: 李鑫 | G88: 15010802967 | H88: 顺丰闪送 | K88: 2020-1-6 | L88: 京东
A89: =COUNT($A$1:A88)+1 -> 34 | B89: Decklink SDI 4K | C89: 6030038 6029719 6161829 | D89: 3 | E89: 王艺兴 | F89: 万鹏 | G89: 15210646056 | H89: 京东 | J89: JDVA01523770549 | K89: 2020-1-6 | L89: 京东
A90: =COUNT($A$1:A89)+1 -> 35 | B90: L-4E6AT | C90: 50m卡侬做头 | D90: 2 | E90: 王艺兴 | F90: 马良 | G90: 18911197399 | H90: 顺丰闪送 | K90: 2020-1-6
C91: 100m卡侬做头 | D91: 2
B92: L-4CFB+ | C92: 3m做头 | D92: 2
A93: =COUNT($A$1:A92)+1 -> 36 | B93: Decklink 8K Pro | C93: 6160665 | D93: 1 | E93: 王增杰 | F93: 赖家水 | G93: 15989293708 | H93: 顺丰 | I93: 18 | J93: SF1082052672315 | K93: 2020-1-6 | L93: 代张凤娣发
A94: =COUNT($A$1:A93)+1 -> 37 | B94: Video Assist | C94: 5098145 | D94: 1 | E94: 王艺兴 | F94: 戴？ | H94: 闪送 | K94: 2020-1-6
A95: =COUNT($A$1:A94)+1 -> 38 | B95: 话筒功放 | D95: 1 | E95: 王艺兴 | F95: 曾令武 | H95: 顺丰寄付 | J95: SF1082052673374 | K95: 2020-1-6 | L95: 客户发错 代发至曾令武
A96: =COUNT($A$1:A95)+1 -> 39 | B96: 2排9针公母 | D96: 1对 | E96: 小杨 | F96: 前线 | H96: 送货 | K96: 2020-1-7
B97: ys202D | D97: 3
A98: =COUNT($A$1:A97)+1 -> 40 | B98: DeckLink Mini Monitor | C98: 6235847 6236589 6194429 6195219 6195215 | D98: 5 | E98: 王艺兴 | F98: 张伟旋 | G98: 13580506375 | H98: 顺丰 | J98: SF1082052672333 | K98: 2020-1-7 | L98: 京东
A99: =COUNT($A$1:A98)+1 -> 41 | B99: L-2.5CHD+ | C99: 1.5m做头 | D99: 2 | E99: 王艺兴 | F99: 谈盈飞 | G99: 13814067326 | H99: 中通 | J99: 640160175307 | K99: 2020-1-7 | L99: 淘宝美丽
A100: =COUNT($A$1:A99)+1 -> 42 | B100: Mini Converter Sync Generator | C100: 6015129 | D100: 1 | E100: 王艺兴 | F100: 饶先旺 | G100: 15919890136 | H100: 顺丰 | J100: SF1082083761322 | K100: 2020-1-7 | L100: 京东
A101: =COUNT($A$1:A100)+1 -> 43 | B101: Mini Converter UpDownCross HD | C101: 6163257 6163265 | D101: 2 | E101: 王艺兴 | F101: 戴祥 | G101: 13146378401 | H101: 闪送 对方下单 | K101: 2020-1-7 | L101: 戴总 允驰创新对公
A102: =COUNT($A$1:A101)+1 -> 44 | B102: L-2.5CHD+ | D102: 3箱 | E102: 王增杰 | F102: 郭强 | G102: 18805365711 | H102: 顺丰 | J102: SF1082052672342 | K102: 2020-1-7 | L102: 奎文
B103: 2B2AT | D103: 1箱
B104: 佳耐美 网线 | D104: 1箱
A105: =COUNT($A$1:A104)+1 -> 45 | B105: BCP-B25HD | D105: 2盒 | E105: 王增杰 | F105: 为杰奎文 | H105: 送货 | K105: 2020-1-7 | L105: 奎文
B106: BCP-B53HD | D106: 50个
B107: YS176 | D107: 20
B108: YS177 | D108: 20
B109: YS202D | D109: 20
B110: YS145 | D110: 6
B111: YS146 | D111: 6
B112: 国产BNC双通 | D112: 10
B113: TC-1
B114: TS-100C
B115: TCD-35CA
A116: =COUNT($A$1:A115)+1 -> 46 | B116: Mini Converter UpDownCross HD | C116: 6163260 | D116: 1 | E116: 王艺兴 | F116: 韩光辉 | G116: 18254810252 | H116: 京东 | J116: JDVA01533307103 | K116: 2020-1-7 | L116: 京东
A117: =COUNT($A$1:A116)+1 -> 47 | B117: DeckLink Mini Monitor | C117: 6235880 6236568 | D117: 2 | E117: 王增杰 | F117: 房启伟 | G117: 15726690453 | H117: 顺丰到付 | J117: SF1082052672351 | K117: 2020-1-7 | L117: 董军 未付款
B118: DeckLink Duo 2 | C118: 6201787 | D118: 1
A119: =COUNT($A$1:A118)+1 -> 48 | B119: 国产BNC双通 | D119: 2 | E119: 王延雷 | F119: 王延雷 | G119: 13522629785 | H119: 顺丰 | J119: SF1082052672379 | K119: 2020-1-7 | L119: 运城
B120: YS1775 | D120: 4
B121: YS176 | D121: 10
B122: YS177 | D122: 10
B123: BCP-B53HD | D123: 50个
A124: =COUNT($A$1:A123)+1 -> 49 | B124: Mini Converter Audio to SDI | C124: 5735748 | D124: 1 | E124: 王艺兴 | F124: 贾雨红 | G124: 18871099813 | H124: 顺丰 | J124: SF1082083761331 | K124: 2020-1-7 | L124: 京东
A125: =COUNT($A$1:A124)+1 -> 50 | B125: BCP-C5FA | D125: 8 | E125: 王增杰 | H125: 送货 | K125: 2020-1-7
B126: TCD-55FA | D126: 1
B127: USB延长线 | C127: 10m | D127: 1
B128: MINI USB数据线 | D128: 1
A129: =COUNT($A$1:A128)+1 -> 51 | B129: Decklink quad 2 | C129: 5749075 | D129: 1 | E129: 王艺兴 | F129: 徐亮 | G129: 15011306516 | H129: 顺丰到付 | K129: 2020-1-7 | L129: 众盛 对公
A130: =COUNT($A$1:A129)+1 -> 52 | B130: Decklink 8K Pro | C130: 6160869 6160828 6160927 6160923 | D130: 4 | E130: 王增杰 | F130: 张凤娣 | G130: 13522200633 | H130: 顺丰到付 | J130: SF1082052672388 | K130: 2020-1-7 | L130: 张凤娣 已付款
A131: =COUNT($A$1:A130)+1 -> 53 | B131: 五类网头 | D131: 10 | E131: 王超飞 | H131: 送货 | K131: 2020-1-8
A132: =COUNT($A$1:A131)+1 -> 54 | B132: AZDEN 310LT | D132: 1 | E132: 王艺兴 | F132: 周芳 | G132: 15910561675 | H132: 普票顺丰 | J132: SF1082052672439 | K132: 2020-1-8 | L132: 对公百年 发票随货
A133: =COUNT($A$1:A132)+1 -> 55 | B133: Mini Converter SDI to HDMI 6G | C133: 5916161 5916350 5915960 | D133: 3 | E133: 王增杰 | F133: 邓斌 | H133: 自提 | K133: 2020-1-8 | L133: 款已对公办，票已开
B134: Mini Converter SDI to Audio 4K | C134: 5609116 | D134: 1
B135: HyperDeck Studio Pro 2 | C135: 6032661 | D135: 1
A136: =COUNT($A$1:A135)+1 -> 56 | B136: L-5.5CUHD | C136: 1m做头 | D136: 1 | E136: 王艺兴 | F136: 徐进 | G136: 13801472891 | H136: 京东 | K136: 2020-1-8 | L136: 京东
A137: =COUNT($A$1:A136)+1 -> 57 | B137: Mini Converter SDI Distribution | C137: 5981187 5981203 | D137: 2 | E137: 王艺兴 | F137: 李春晓 | G137: 18110023167 | H137: 顺丰 | J137: SF1082052672402 | K137: 2020-1-8 | L137: 对公 北京永达天恒体育 发票和合同随货
A138: =COUNT($A$1:A137)+1 -> 58 | B138: 1SKB-ISF4U | D138: 1 | E138: 王艺兴 | F138: Momo | G138: 13764637423 | H138: 京东 | J138: JDVA01543592966 | K138: 2020-1-8 | L138: 京东
B139: 1U盲板 | D139: 1
A140: =COUNT($A$1:A139)+1 -> 59 | B140: TL-71YHD | C140: 瑞鸽摇臂双联屏 | D140: 1 | E140: 王增杰 | F140: 刘志远 | G140: 13911339521 | H140: 顺丰航空寄付 | J140: SF1082083761340 | K140: 2020-1-8
A141: =COUNT($A$1:A140)+1 -> 60 | B141: L-2.5CHD+ | C141: 1m做头 | D141: 1 | E141: 王艺兴 | F141: 我是谁 | G141: 13813838438 | H141: 京东快递 | J141: JDVA01544970139 | K141: 2020-1-8 | L141: 京东
A142: =COUNT($A$1:A141)+1 -> 61 | B142: L-2.5CHD+ | C142: 1m做头 | D142: 1 | E142: 王艺兴 | F142: 老表 | G142: 13813838438 | H142: 京东 | J142: JDVA01544240627 | K142: 2020-1-8 | L142: 京东
A143: =COUNT($A$1:A142)+1 -> 62 | B143: L-5CFB | C143: 1m做头 | D143: 1 | E143: 王艺兴 | F143: 王琳 | G143: 13813838438 | H143: 京东 | J143: JDVA01544260893 | K143: 2020-1-8 | L143: 京东
A144: =COUNT($A$1:A143)+1 -> 63 | B144: L-5.5CUHD | C144: 2m做头 | D144: 1 | E144: 王艺兴 | F144: 李力 | G144: 13813838438 | H144: 京东 | J144: JDVA01544327979 | K144: 2020-1-8 | L144: 京东
A145: =COUNT($A$1:A144)+1 -> 64 | B145: BCJ-XJ-TRC | D145: 1 | E145: 王艺兴 | F145: 紫薇 | G145: 13813838438 | H145: 京东 | J145: JDVA01544230987 | K145: 2020-1-8 | L145: 京东
A146: =COUNT($A$1:A145)+1 -> 65 | B146: Mini Converter Optical Fiber 12G | C146: 6037747 | D146: 1 | E146: 王艺兴 | F146: 喻队 | G146: 13813838438 | H146: 京东 | J146: JDVA01544409978 | K146: 2020-1-8 | L146: 京东
A147: =COUNT($A$1:A146)+1 -> 66 | B147: Mini Converter Optical Fiber 12G | C147: 6037725 | D147: 1 | E147: 王艺兴 | F147: 下夏 | G147: 13813838438 | H147: 京东 | J147: JDVA01544428985 | K147: 2020-1-8 | L147: 京东
A148: =COUNT($A$1:A147)+1 -> 67 | B148: DeckLink 4K Extreme 12G | C148: 6160627 | D148: 1 | E148: 王艺兴 | F148: 贺慧玲 | G148: 13478317411 | H148: 顺丰 | J148: SF1082083761359 | K148: 2020-1-8 | L148: 辽宁向日葵对公 发票 合同随货
A149: =COUNT($A$1:A148)+1 -> 68 | B149: DeckLink Studio 4K | C149: 6223912 6156009 | D149: 2 | E149: 王艺兴 | F149: 王浩 | G149: 13366178746 | H149: 顺丰 | J149: SF1082083761368 | K149: 2020-1-8 | L149: 北京美辰乐视 对公 发票随货
B150: Micro Converter BiDirectional SDI/HDMI wPSU | C150: 6083888 6082731 | D150: 2
A151: =COUNT($A$1:A150)+1 -> 69 | B151: UltraStudio 4K Mini | C151: 6073597 | D151: 1 | E151: 王艺兴 | F151: 龙华山 | G151: 13421329852 | H151: 顺丰 | J151: SF1082052672411 | K151: 2020-1-8 | L151: 京东
A152: =COUNT($A$1:A151)+1 -> 70 | B152: Intensity Pro 4K | C152: 6174176 | D152: 1 | E152: 王艺兴 | F152: 关兰海 | H152: 顺丰 | J152: SF1082052672420 | K152: 2020-1-8 | L152: 淘宝美丽 未税
A153: =MAX($A$152:A152)+1 -> 71 | B153: L-4E6S | C153: 177BG/176BG 10m做头 | D153: 4 | E153: 王艺兴 | F153: 张海琴 | G153: 18115536482 | H153: 顺丰 | K153: 2020-1-8 | L153: 京东 1.10发
A154: =MAX($A$152:A153)+1 -> 72 | B154: Blackmagic URSA Mini 4K EF | C154: 6146293+6146290+6145789 | D154: 3 | E154: 王延雷 | F154: 叶亮亮 | G154: 15925955875 | H154: 中通 | J154: 640160175306 | K154: 2020-1-9 | L154: 横店
B155: Blackmagic URSA Mini Shoulder Kit | C155: 5843795+5952393+6050716 | D155: 3
A156: =MAX($A$152:A155)+1 -> 73 | B156: 数字版16 | C156: 6083081 | D156: 1 | E156: 王艺兴 | F156: 林森 | G156: 13050477775 | H156: 顺丰 | J156: SF1082083761377 | K156: 2020-1-9 | L156: 京东
A157: =MAX($A$152:A156)+1 -> 74 | B157: L-4E6S | C157: 10米做甬声头 | D157: 1 | E157: 王艺兴 | F157: 袁强 | G157: 13990092996 | H157: 京东 | J157: JDVA0155918167 | K157: 2020-1-9 | L157: 京东
A158: =MAX($A$152:A157)+1 -> 75 | B158: L-2B2AT | C158: 100米线 | D158: 1 | E158: 王艺兴 | F158: 纪秀丽 | G158: 15247609637 | H158: 京东 | K158: 2020-1-9 | L158: 京东
A159: =MAX($A$152:A158)+1 -> 76 | B159: L-5.5CUHD | C159: 10米做头 | D159: 1 | E159: 王艺兴 | F159: 胡晶 | G159: 18888831540 | H159: 京东 | K159: 2020-1-9 | L159: 京东
A160: =MAX($A$152:A159)+1 -> 77 | B160: L-4E6S | C160: 710cm | D160: 1 | E160: 王艺兴 | F160: 王聪 | G160: 13701585509 | H160: 京东 | K160: 2020-1-9 | L160: 京东
C161: 630cm | D161: 2
C162: 500cm | D162: 1
C163: 450cm | D163: 2
A164: =MAX($A$152:A163)+1 -> 78 | B164: Mini Converter UpDownCross HD | C164: 6163263+6163219 | D164: 2 | E164: 王增杰 | F164: 耿高生 | G164: 13691530672 | H164: 顺丰到付 | J164: SF1082083761386 | K164: 2020-1-9 | L164: 对公已收款 专票随货
A165: =MAX($A$152:A164)+1 -> 79 | B165: GPI and Tally Interface | C165: 6000202 | D165: 1 | E165: 王增杰 | F165: 刘志 | G165: 13524151381 | H165: 顺丰航空到付 | J165: SF1082083761395 | K165: 2020-1-9 | L165: 对公已收款 专票随货
A166: =MAX($A$152:A165)+1 -> 80 | B166: Decklink Studio 4K | C166: 6155953 | D166: 1 | E166: 王增杰 | F166: 赵章全 | G166: 15612196689 | H166: 顺丰到付 | J166: SF1082083761400 | K166: 2020-1-9 | L166: 赵常战 往来账 未付款
A167: =MAX($A$152:A166)+1 -> 81 | B167: 甬声大三芯ys202D | D167: 2 | E167: 小杨 | F167: 前线 | H167: 送货 | K167: 2020-1-9 | L167: 前线
B168: 音响头ys650 | D168: 6
B169: 音响母座ys652 | D169: 2
B170: Clear Com 耳机 | D170: 1
A171: =MAX($A$152:A170)+1 -> 82 | B171: 0SMO Pocket运动充电盒 | D171: 3 | E171: 王延雷 | F171: 空军记者站 | H171: 送货 | K171: 2020-1-9 | L171: 空军记者站 G6S
B172: 0SMO Pocket无线模块 | D172: 3
B173: 0SMO Pocket加长杆 | D173: 3
B174: OSMO Pocket拓展配件转接套 | D174: 3
B175: OSMO Pocket磁吸ND减光镜套装(欠2) | D175: 3
B176: 0SM0 Pocket防水盒 | D176: 1
B177: Mavic2全能配件包 | D177: 2
B178: G6S | D178: 1套
B179: Decklink Mini Monitor 4K | C179: 6088012 | D179: 1 | E179: 王艺兴 | F179: 顾健 | G179: 13915990388 | H179: 京东 | J179: JDVA01560168817 | K179: 2020-1-10 | L179: 京东
B180: HDMI线 | D180: 1
B181: XA20s*8.5BRM-K3 | C181: 4879404+4879218 | D181: 2 | E181: 王延雷 | F181: 王延雷 | G181: 13522629785 | H181: 顺风 | J181: SF1082083761428 | K181: 2020-1-10 | L181: 运城
B182: MS-01私服 | D182: 2
B183: YS551 | C183: 网络座 | D183: 2
B184: NC3MXX | D184: 5 | E184: 王艺兴 | F184: Yolamda | H184: 京东 | J184: JDVA01563252416 | K184: 2020-1-10 | L184: 京东
B185: NC3FXX | D185: 5
B186: Teranex Mini SDI to HDMI 12G | C186: 6099974 | D186: 1 | E186: 王艺兴 | F186: 戴祥 | G186: 3146378401 | H186: 顺丰到付 | J186: 263235918518 | K186: 2020-1-10 | L186: 允驰创新对开
B187: Teranex Mini Smart Panel | C187: 6197529 | D187: 1
B188: 1SKB-R10U | D188: 1 | E188: 王艺兴 | F188: 洋铭李敏 | H188: 自提 | K188: 2020-1-10 | L188: 睿信远道对公杰明
B189: L-5.5CUHD | C189: 70米 不做头 | D189: 3 | E189: 王艺兴 | F189: 李乔健 | G189: 18327589111 | H189: 顺丰 | J189: 263235918527 | K189: 2020-1-10 | L189: 湖北坤泰幕墙装饰工程有限公司 对公杰明
B190: Micro Studio Camera 4K - Cable | C190: 6229366 | D190: 1 | E190: 王艳霞 | F190: 王斌 | G190: 13764945850 | H190: 顺丰到付 | J190: 13764945850 | K190: 2020-1-10
B191: decklink studio 4k | C191: 6155273 | D191: 1 | E191: 王艳霞 | F191: 夏玲 | G191: 18997999487 | H191: 顺丰航空寄付 | J191: SF1082052672448 | K191: 2020-1-10 | L191: 货票同行
B192: YS650 | D192: 6 | E192: 史为鹏 | F192: 前线 | H192: 送货 | K192: 2020-1-10 | L192: 前线
B193: YS652 | D193: 2
B194: 音响橡胶头 | D194: 6
B195: BLX14CN/CVL-M17 | C195: 3PA2954076 | D195: 1 | E195: 王艺兴 | F195: 陈伟 | G195: 18210494393 | H195: 京东 | J195: JDVA01571302206 | K195: 2020-1-11 | L195: 京东
B196: Micro Converter BiDirectional SDI/HDMI wPSU | C196: 6083750 6083822 | D196: 2 | E196: 王艺兴 | F196: 李志江 | G196: 17699551616 | H196: 京东 | J196: JDVA01571383869 | K196: 2020-1-11 | L196: 京东
B197: Mini Converter SDI Distribution | C197: 6179267 5981186 | D197: 2
B198: L-5.5CUHD | C198: 2米做头 | D198: 10 | E198: 王艺兴 | F198: 陈常斌 | G198: 18922787117 | H198: 京东 | K198: 2020-1-11 | L198: 京东
B199: Decklink 8K Pro | C199: 6160859 | D199: 1 | E199: 王增杰 | F199: 郭强 | H199: 闪送 对方下 | K199: 2020-1-11 | L199: 中科云视 未付款
B200: L-2.5CHD+ | D200: 1箱 | E200: 王艺兴 | F200: 张伟 | H200: 自提 | K200: 2020-1-11 | L200: 微信收
B201: BCP-B25HD | D201: 1个
B202: Micro Converter HDMI to SDI wPSU | C202: 5627302 5559908 5558638 5557673 5558484 5558511 | D202: 6 | E202: 王增杰 | F202: 吴美平 | G202: 18907096861 | H202: 顺丰寄付 | I202: 21 | J202: 263235918536 | K202: 2020-1-11 | L202: 王洪仕~未付款
B203: EDIUS PRO 9 | C203: 161653 482798 629675 | D203: 3 | E203: 王艺兴 | F203: 邹晓钦 | G203: 15071177838 | H203: 顺丰航空 寄付 | J203: SF1082052672457 | K203: 2020-1-11 | L203: 淘宝 美丽
B204: EDIUS键鼠 | D204: 3
B205: L-5.5CUHD | C205: 1m做头 | D205: 1 | E205: 王艺兴 | F205: 马子涛 | G205: 18689751206 | H205: 京东 | J205: JDVA01575859316 | K205: 2020-1-11 | L205: 京东
B206: DeckLink Mini Monitor 4K | C206: 6088128 | D206: 1 | E206: 王艺兴 | F206: 顾建新 | G206: 13501542401 | H206: 京东 | J206: JDVA01585848370 | K206: 2020-1-12 | L206: 京东
B207: 612A/320A-EIA | D207: 1 | E207: 王艺兴 | F207: 周海峰 | G207: 15301466488 | H207: 京东 | J207: JDVA01585989183 | K207: 2020-1-12 | L207: 京东
B208: L-3.3CUHD | C208: 1m做头 | D208: 10 | E208: 王艺兴 | F208: 王磊 | G208: 13053463698 | H208: 顺丰 | J208: SF1082052672475 | K208: 2020-1-12 | L208: 微信
B209: L-2.5CHD+ | C209: 10m不做头 | D209: 1
B210: BlackMagic Pocket Cinema Camera 4K | C210: 6080267 | D210: 1 | E210: 王增杰 | F210: 傅小姐 | G210: 13802920988 | H210: 顺丰到付 | J210: SF1082052672466 | K210: 2020-1-12 | L210: 代李东发 未付款
B211: L-4S6 | C211: 10m不做头 | D211: 2 | E211: 小杨 | F211: 前线 | H211: 送货 | K211: 2020-1-12 | L211: 前线
B212: YS240 | D212: 1
B213: YS231L | D213: 1
B214: 国产BNC座 | D214: 1
B215: L-4E6S | C215: 177BG/176GB 10米 | D215: 1 | E215: 王艺兴 | F215: 张海琴 | G215: 18115536482 | H215: 顺丰陆运 | J215: 263235918545 | K215: 2020-1-13 | L215: 京东 有条有问题
B216: 突破PDU | D216: 15 | E216: 王增杰 | F216: 史为超 | G216: 15032007886 | H216: 京东 | K216: 2020-1-13 | L216: 奎文
B217: BlackMagic Pocket Cinema Camera 4K | C217: 6126388 6127188 6080546 6127051 6127066 | D217: 5 | E217: 王增杰 | F217: 李东 | H217: 达达 对方下单 | K217: 2020-1-13 | L217: 款已清
B218: DeckLink 8K Pro | C218: 6203191 6160939（入库为6160938） | D218: 2 | E218: 王艺兴 | F218: 文兵 | G218: 18674852465 | H218: 顺丰 | J218: SF1082083761455 | K218: 2020-1-13 | L218: 京东
B219: DeckLink Mini Monitor 4K | C219: 6087939 | D219: 1 | E219: 王艺兴 | F219: 曹 | G219: 17317764897 | H219: 顺丰陆运寄付 | J219: SF1082052672818 | K219: 2020-1-13 | L219: 京东
B220: HDMI线 | D220: 1
B221: L-2T2S | C221: 优曲克公母做头 | D221: 2 | E221: 王艺兴 | F221: 王聪 | G221: 13701585509 | H221: 京东 | J221: JDVA01597139017 | K221: 2020-1-13 | L221: 京东
B222: L-5.5CUHD | C222: 100m做头 | D222: 1 | E222: 王艳霞 | F222: 任尚昆 | G222: 18678820082 | H222: 京东 | J222: JDX001098451212 | K222: 2020-1-13 | L222: 货票同行
C223: 50m做头 | D223: 2
C224: 1m做头 | D224: 3
B225: Teranex Mini Smart Panel | C225: 6196273 6196150 | D225: 2 | E225: 王艺兴 | F225: 百度李哲 | H225: 自提 | K225: 2020-1-13 | L225: 支付宝收款 发票已开
B226: Blackmagic Web Presenter | C226: 6035065 6035069 | D226: 2
B227: 电源线 | D227: 2
B228: 旧视频线 | D228: 3
B229: BCP-B4F | D229: 50个 | E229: 王艺兴 | F229: 杨婷 | G229: 15907797763 | H229: 顺丰陆运 | J229: SF1082052672827 | K229: 2020-1-13 | L229: 京东
B230: ADX-LED-1510B | D230: 1 | E230: 王艺兴 | F230: 郭广波 | G230: 18224947855 | H230: 厂家直发 | J230: SF1076553832528 | K230: 2020-1-13 | L230: 京东
B231: ATEM Mini | C231: 6227465 | D231: 1 | E231: 王增杰 | F231: 张杰 | G231: 18976769921 | H231: 顺丰航空寄付 | J231: SF1082052672836 | K231: 2020-1-14 | L231: 微信已收款
B232: Mini Converter Audio to SDI | C232: 6110641 | D232: 1 | E232: 王艺兴 | F232: 沈易 | G232: 18915596869 | H232: 顺丰航空寄付 | J232: SF1082052672863 | K232: 2020-1-14 | L232: 京东
B233: 雷电三转二线 | D233: 1 | E233: 王艺兴 | F233: 李鑫 | G233: 15239464168 | H233: 顺丰航空 | J233: SF1082052672872 | K233: 2020-1-14 | L233: 淘宝彩虹
B234: L-4E5AT | D234: 2箱 | E234: 王增杰 | F234: 王明仕 | G234: 13667955988 | H234: 顺丰陆运到付 | J234: SF10820526722881 | K234: 2020-1-14 | L234: 亿阳 未付款
B235: L-4.5CHD+ | D235: 2箱
B236: BCP-B53 | D236: 20个
B237: NC3MXX | D237: 10个
B238: NC3FXX | D238: 10个
B239: NC5FXX | D239: 10个 | E239: 王增杰 | F239: 王明仕 | G239: 13667955988 | H239: 邓道斌代发 | K239: 2020-1-14 | L239: 亿阳未付款
B240: NC5MXX | D240: 10个
B241: 大号绕线车 | D241: 2 | E241: 王增杰 | F241: 朱峰 | G241: 13543213398 | H241: 天影代发 | K241: 2020-1-14 | L241: 亿阳未付款
B242: 特大号绕线车 | D242: 2
B243: L-2T2S | D243: 1箱 | E243: 王艺兴 | F243: 顾鹏程 | G243: 15052058877 | H243: 顺丰陆运 | J243: SF1082052672890 | K243: 2020-1-14 | L243: 京东
B244: teranex Mini sdi to hdmi 12G | C244: 6173166 | D244: 1 | E244: 王增杰 | F244: 鄂苏静 | G244: 13522575267 | H244: 顺丰寄付 | J244: SF1082052672854 | K244: 2020-1-14 | L244: 代王清亮发~微信已收款
B245: Micro Converter SDI to HDMI wPSU | C245: 6209564 6209556 6209804 | D245: 3 | E245: 王增杰 | F245: 童悦 | G245: 13810328140 | H245: 顺丰寄付 | I245: 13 | J245: SF1082052672906 | K245: 2020-1-14 | L245: 代李东发 未付款
B246: BLX14CN/CVL | C246: 3PB2933146 3PA2954065 3PF1787226 | D246: 3 | E246: 王艺兴 | F246: 陈伟 | G246: 18210494393 | H246: 顺丰寄付 | J246: SF1082052672915 | K246: 2020-1-14 | L246: 京东
B247: Monarch HDX | D247: 1 | E247: 王艺兴 | F247: 王丽 | G247: 13810700406 | H247: 李敏代发 | J247: 164962959838 | K247: 2020-1-14 | L247: 对公 睿信李敏代发
B248: AJA Hi5-4K-Plus | D248: 1 | E248: 王艺兴 | F248: 张姗妹 | G248: 18576437755 | H248: 顺丰陆运 | J248: SF1082052673091 | K248: 2020-1-14 | L248: 京东
B249: SmartView 4k | C249: 5516061 | D249: 1 | E249: 王艺兴 | F249: 张玲 | G249: 13520963242 | H249: 闪送 | K249: 2020-1-14 | L249: 创利佳业 对公
B250: Davinci Resolve Studio | C250: 5953943 | D250: 1 | E250: 王增杰 | F250: 赵常战 | H250: 序列号拍照 货待发 | K250: 2020-1-14
B251: H.264 Pro Recorder | C251: 5380785 | D251: 1 | E251: 王增杰 | F251: 唐唐 | G251: 15021389005 | H251: 顺丰寄付 | I251: 18 | J251: SF1082052672933 | K251: 2020-1-14 | L251: 代张凤娣发 未付款
B252: Decklink SDI 4K | C252: 6161877 | D252: 1 | E252: 王增杰 | F252: 刘明友 | G252: 17600720802 | H252: 顺丰陆运 | J252: SF1082052672942 | K252: 2020-1-14 | L252: 文香 已付
B253: L-2.5CHD+ | C253: 12m做头 | D253: 2 | E253: 苏帅龙 | F253: 前线 | H253: 送货 | K253: 2020-1-15 | L253: 前线
C254: 15m做头 | D254: 1
B255: Micro Converter SDI to HDMI wPSU | C255: 6209557 6209825 6209563 6209554 6209615 6146278 | D255: 6 | E255: 王增杰 | F255: 徐俊 | G255: 18638786051 | H255: 顺丰寄垫付 | J255: 263235918554 | K255: 2020-1-15 | L255: 代王辉发
B256: BCJ-JK | D256: 10 | E256: 王艺兴 | F256: 于殿彬 | G256: 13911708912 | H256: 顺丰陆运 | J256: 263235918563 | K256: 2020-1-15 | L256: 京东
B257: BCP-B5F | D257: 30
B258: Decklink SDI 4K | C258: 6162074 | D258: 1 | E258: 王艺兴 | F258: 李云 | G258: 13880950236 | H258: 顺丰 | J258: SF1082052672951 | K258: 2020-1-15 | L258: 京东
B259: NC3MXX | D259: 50 | E259: 王艺兴 | F259: LEE HYEONG IL | G259: 18616219523 | H259: 顺丰陆运 | J259: SF1082052672960 | K259: 2020-1-15 | L259: 京东
B260: Decklink SDI 4K | C260: 6161864 | D260: 1 | E260: 王增杰 | F260: 段小强 | G260: 13848462377 | H260: 顺丰陆运 | I260: 18 | J260: SF1082052672979 | K260: 2020-1-15 | L260: 文香 未付款 CGA20200113055
B261: Decklink SDI 4K | C261: 6161865 | D261: 1 | E261: 王增杰 | F261: 刘明友 | G261: 17600720802 | H261: 顺丰陆运 | I261: 18 | J261: SF1082052672988 | K261: 2020-1-15 | L261: 文香 未付款 CGA20200106026
B262: Decklink Studio 4K | C262: 6223759 | D262: 1 | E262: 王艳霞 | F262: 夏玲 | G262: 18997999487 | H262: 顺丰航空寄付 | J262: SF1082052673000 | K262: 2020-1-15
B263: HDMI | C263: 1.2m | D263: 15 | E263: 王增杰 | F263: 史为超 | G263: 15032007886 | H263: 顺丰航空寄付 | J263: SF1082052673046 | K263: 2020-1-16 | L263: 奎文
B264: 五芯卡侬母座旧 | D264: 9
B265: 五芯卡侬母头旧 | D265: 9
B266: ys1775 | D266: 4
B267: 1SKB-VS-1 | D267: 1 | E267: 王艳霞 | F267: 达尔亨 | G267: 15047943690 | H267: 顺丰到付 | J267: SF10182052673064 | K267: 2020-1-16
B268: Mini Converter UpDownCross HD | C268: 6163228 | D268: 1 | E268: 王艺兴 | F268: 刘旭 | G268: 17895058839 | H268: 顺丰 | J268: SF1082052673037 | K268: 2020-1-16 | L268: 淘宝美丽
B269: Decklink 4K Extreme 12G | C269: 6162304 | D269: 1 | E269: 王艺兴 | F269: 强氧 | H269: 顺丰 | K269: 2020-1-16 | L269: 维修/换新
B270: Mini Converter Sync Generator | C270: 6015498 | D270: 1 | E270: 王延雷 | F270: 王延雷 | G270: 13522629785 | H270: 顺丰航空寄付 | J270: SF1082052673055 | K270: 2020-1-16 | L270: 横店
B271: 旧视频线 | D271: 4
B272: 1SKB-R8W | D272: 1 | E272: 王艳霞 | F272: 任尚昆 | G272: 18678820082 | H272: 京东 | K272: 2020-1-18 | L272: 集成
B273: 恒豪SDI抽拉监视器 | D273: 1
B274: 接口板 | D274: 2
B275: 导播抽拉架 | D275: 1
B276: PDU | D276: 1
B277: 电源线 | D277: 5
B278: 网座 | D278: 1
B279: HDMI座 | D279: 1
B280: USB座 | D280: 1
B281: BCJ-jrudk | D281: 13
B282: NC3MXX | D282: 2
B283: NC3FXX | D283: 4
B284: 音视频线
B285: L-4.5CHD+ | C285: 50m做头 | D285: 1 | E285: 王艺兴 | F285: 李 | G285: 15900239836 | H285: 京东 | K285: 2020-1-19 | L285: 微信
C286: 30m做头 | D286: 4
B287: BCJ-JK | D287: 5
B288: Decklink DUO 2 | C288: 6103266 | D288: 1 | E288: 王增杰 | F288: 吴晗 | G288: 18810035860 | H288: 顺丰垫付 | J288: 263235918581 | K288: 2020-1-20 | L288: 代李山发 微信未税 运费已收
B289: Mini Converter HDMI to SDI 6G | C289: 5972786+5972494 | D289: 2 | E289: 王增杰 | F289: 张凤娣 | H289: 闪送 | K289: 2020-1-20 | L289: 张凤娣 未付
B290: Davinci Resolve Studio | C290: 6042134 | D290: 1 | E290: 王增杰 | F290: 李钢 | G290: 13601888907 | H290: 顺丰寄付 | J290: 2632359118590 | K290: 2020-1-20 | L290: 微信已收
B291: BCP-B5F | D291: 42 | E291: 王艺兴 | F291: 尚娜 | G291: 18291889584 | H291: 顺丰航空 | J291: 263235918606 | K291: 2020-1-20 | L291: 京东
B292: Mini Converter UpDownCross HD | C292: 6164762 | D292: 1 | E292: 王艳霞 | F292: 邹子 | G292: 15989125260 | H292: 顺丰陆运 | J292: 263235918615 | K292: 2020-1-21
B293: SGM-2100 | D293: 10. | E293: 王增杰 | F293: 张子磊 | H293: 自提 | K293: 2020-1-21
B294: 310LT | D294: 5.
B295: 310HT | D295: 5.
B296: V5 | D296: 1.